id,code,type,name,address,commune,wilaya_code,lat,lng
13-165,1327,pdv,DELLAA PHONE,RUE KASTOR N31,SEBDOU,13,,
13-166,1328,pdv,PDV  DAOUDI BOUMEDYENE,HAI LATI HADJ AHMED LOCAL N01,SEBDOU,13,,
13-167,1329,pdv,PDV  LARIBI BOUFELDJA,RUE LE MARTYRE BOUANANI HOUCINE LOCALE N 02,SEBDOU,13,,
13-168,1331,pdv,VISION PHONE,LOCAL N01 SIDI DJILALI,SIDI DJILALI,13,,
13-169,1332,pdv,PDV  BENYOUCEF YAHIA,RUE 18 FEVRIER SID DJILALI,SIDI DJILALI,13,,
13-170,1333,pdv,TELEPHON IKKA,HAI BAB DJIADE BOULVARD REHIBA N B18,TLEMCEN,13,,
13-171,1334,pdv,PDV  TABET ZATLA MOHAMMED RIAD,RUE GAOUAR HOCINE NC27,TLEMCEN,13,,
13-172,1335,pdv,PDV  ABDERRAHIM PHONE,PROJET 144 LOGEMENTS PARTICIPATIF DORJ 01 TRANCHE 08LOCAL 8OUDJLIDA,TLEMCEN,13,,
13-173,1336,pdv,PDV  CHARIF HOUSSAM EDDINE,CITE COMANDAN FERADJ N 18,TLEMCEN,13,,
13-174,1337,pdv,PDV  GERMANY PHONE,N19 RUE DE LINDEPENDANCE,TLEMCEN,13,,
13-175,1338,pdv,PDV  BENKHALDI PHONE,LOCAL N 02 RIAT EL KEBIR TRANCHE 243 LOTISSEMENT N126,TLEMCEN,13,,
13-176,1339,pdv,PDV  TBAHRITI ABDELHAK,HAI SIDI CHAKEUR BOULVARD FRER ZEROUKI N12TRACHE 219 LOTISSEMENT 55,TLEMCEN,13,,
13-177,1340,pdv,MY PHONE,RU GAOUAR HOUCINE LOCAL N02 HAI EL REHIBA BAB DJIAD TLEMCEN,TLEMCEN,13,,
13-178,1341,pdv,PDV  DJAWHARA TELECOM,IFRAZ BOUSIJOUR BOUDGHENE RUE 24 METR N16 B,TLEMCEN,13,,
13-179,1342,pdv,PDV DERBAL HOUSSEYN,N 34 TRANCHE OUDJLIDA ABOU TACHFINE GROUP D LOCAL N 01,TLEMCEN,13,,
13-180,1343,pdv,PDV  AMARA ZENATI SIDI MOHAMMED,ROUTE SIDI BOUMEDIENE,TLEMCEN,13,,
13-181,1344,pdv,PDV  CHABANE SARI BENAMAR,HAI EL KIFFANE 348LOGEMENT BT A LOTISSEMENT N 01LOCAL A,TLEMCEN,13,,
13-182,1345,pdv,PDV  BENABDALLAH ABDESSAMED,HAI BOUDGHENE TRANCHE 247 LOTISSEMENT 352,TLEMCEN,13,,
13-183,1346,pdv,PDV  CELLULAIRE,BOULVARD COLONEL LOTFI LOCAL N02 N06,TLEMCEN,13,,
13-184,1347,pdv,JTN PHONE,LOCAL N 02 CITE EL FIDAIYINE TLEMCEN,TLEMCEN,13,,
13-185,1348,pdv,PDV.  BENDAOUDI MOHAMMED ADIL,LOCALE N 01 REZ DE CHAUSSEE N39 RUE GAOUAR HOUSSINE,TLEMCEN,13,,
13-186,1349,pdv,PDV  BELABBES LAHCENE,ZAOUIA RUE BELHADJI BOUCIF BOULAVARD COLONEL LOTFI,TLEMCEN,13,,
13-187,1350,pdv,NOOR PHONE,N 05 BOULVARD 1 NOVEMBRE LOCAL N01,TLEMCEN,13,,
13-188,1351,pdv,PDV  HADJIDJ MOHAMED SALIM,LOCAL N 01LES AMANDIERES BOLVARD BOUSIJOUR N05 DU PLAN DE PARTAG,TLEMCEN,13,,
13-189,1352,pdv,PDV  KARA SLIMANE MOHAMMED ZAKARIA,HAI DAHLIA EL KIFFANE N D282 TLEMCEN,TLEMCEN,13,,
13-190,1353,pdv,PDV  BELABBAS KELTOUMA,EL KIFFANE LOTISSEMENT N06 TRANCHE 149 LOCALE N05,TLEMCEN,13,,
13-191,1354,pdv,PDV TAIBI AISSAM,RUE LINDEPENDANCE N35,TLEMCEN,13,,
13-192,1355,pdv,PDV  PLAISIR DOFFRIR,N12 BOULVARD BEJAOUI CHAOUCH AHMED LOCAL N 01,TLEMCEN,13,,
13-193,1356,pdv,PDV  BRAHMI YOUSSOUF,N 22 RUE A LOCAL N 02,ZENATA,13,,
13-194,10738,pdv,PDV  BOUDJELLOUL MOHAMMED CHAWKI,N56 RUE BENAHMED HADJ LOCALE N02 COMMUNE SABRA,SABRA,13,,
13-195,10739,pdv,PDV  BENMAMMAR NADIRA,LOCALE N 01RUE JERUSALEM,SEBDOU,13,,
13-196,10740,pdv,PDV  BENHASSINE MOHAMMED,LOCALE N02 RUE EL FETH LOTICEMENT 189 N 144 COMMUNE MAGHNIA,MAGHNIA,13,,
13-197,10741,pdv,PDV  RAHMOUNE FETH ALLAH,RUE SI TAREK LOTICEMENT N 190 N72 LOCALE N 06 COMMUNE REMCHI,REMCHI,13,,
13-198,10742,pdv,PDV  HOUSSEYN,RUE CASTORE N 33 LOCALE N1,HENNAYA,13,,
13-199,10743,pdv,PDV  KEBLI GSM,N65 023 DIST ILOT 87 CITE BOUDJLID RUE BORGHAM GUENDOUZ TOUNANE LOCAL N03,SOUAHLIA,13,,
13-200,10744,pdv,PDV  OUSEDRAT KARIM,LOCALE N02 RUE LES OLIVIER LOTICEMENTE N 182 N203 COMMUNE MAGHNIA,MAGHNIA,13,,
13-201,10745,pdv,PDV  KALAIDJI PHONE,LOCAL A TAOUNIA IBN SINA N72,CHETOUANE,13,,
13-202,10746,pdv,PDV  NEMRI PHONE,LOCAL N01 RUE 01 NOVEMBRE TERRAIN 06 CLASS 26,GHAZAOUET,13,,
13-203,11169,pdv,PDV  AMIN,LOCALE N 02 RUE MOULAY AMOUHAMED,MANSOURAH,13,,
13-204,11170,pdv,PDV  ABDELMOUMEN,N184 LOTISSEMENT OUESTRUE KHMISTI LOCALE N03,HENNAYA,13,,
13-205,11171,pdv,PDV  SOULIMANE PHONE,BOUDJLIDA BATIMENT H TRANCHE N187 N638 CLASS 271,TLEMCEN,13,,
13-206,11172,pdv,PDV  ABDELHAK,RUE MOSQUE LOCALE N 01,BENSEKRANE,13,,
13-207,11173,pdv,PDV  BENMOUNA PHONE,LOCAL N01 OUZIDANE TERRAIN 40 CLASS 23,CHETOUANE,13,,
13-208,11174,pdv,PDV  RABIA EP BENTRARI TAYEB NENYAHIA,RUE ARBI BEN MHIDI N045 LOTICEMENT099 COMMUNE REMCHI,REMCHI,13,,
13-209,11175,pdv,PDV  FERITIS YAMINA,RUE MARTYRE BOUANAN HOCINE LOCALE N 02 N 146,SEBDOU,13,,
13-210,11176,pdv,PDV  RAHMOUNI PHONE,BOUDJLIDA CLASS 271 GROUPE 166 BATIMENT A2 TRANCHE 43,TLEMCEN,13,,
13-211,11177,pdv,PDV  MEHADJI PHONE,SECTION TIANET LOCAL N02 S,TIANET,13,,
13-212,11178,pdv,PDV  KECHEKOUCH MOHAMMED,N36 TRIANGLE RUE COMMANDAN DJABER ET RUE IBN KHAMIS TRANCHE 02,TLEMCEN,13,,
13-213,11179,pdv,PDV  MEBKHOUTI MUSTAPHA,HAI 01 NOVEMBRE,EL ARICHA,13,,
13-214,11180,pdv,PDV  BOUALAM YOUCEF,ZAHRAT EL AZAILS,AZAILS,13,,
13-215,11181,pdv,PDV  KHEMIES OUSSAMA,HAI SIDI SAID N54 BT I TRANCHE N45 LOTISSEMENT 127,TLEMCEN,13,,
13-216,11182,pdv,PDV  MAHDJOUB FADLALLAH,LOCALE N 01RUE LES OLIVIERS TRANCHE 87 LOTISSEMENT 50,TLEMCEN,13,,
13-217,11183,pdv,PDV  ATTAR PHONE,SAFSAF LOCAL N16,CHETOUANE,13,,
13-218,11184,pdv,PDV  BENRAMDANE MOHAMMED ADEL,BEN MERD RUE DRAR ABDERAHMANE N 05 LOCALE 03 EL KIFFANE,TLEMCEN,13,,
13-219,11185,pdv,PDV  BEKHTI SIDI MOHAMMED,RESIDENCE EL MITHAK 02 BT A3 LOTSSEMENT N31 EL KIFFANE,TLEMCEN,13,,
13-220,11186,pdv,PDV  KALAIDJI YAHIA,BOULVARD GAOUAR HOCINE N36 ET 37 BIS 02,TLEMCEN,13,,
13-221,11187,pdv,PDV  GSM MEDJADI FADIA,N 11 RUE ZEROUKI ABDELKRIM HAU EL KALAA LOCALE N01 LOTISSEMENT 205,TLEMCEN,13,,
13-222,11188,pdv,PDV  BENMOSTEFA HICHAM,CITE DES MARTYRES,TLEMCEN,13,,
13-223,11189,pdv,PDV  CHEKROUN HOUSSAM EDDINE,LOCALE N 01TRANCHE OUDJLIDA N353 ABOU TACHFINE GROUP D,TLEMCEN,13,,
13-224,11190,pdv,PDV  HADJI SOFIANE,N 41RUE IBN KHAMIS 4EM TRANCHE LOCALE N01,TLEMCEN,13,,
13-225,11191,pdv,PDV  ABDERRAHIM RABIE,KALLA COTE SUD BV 24 METRE HAI SIDI CHAKEUR LOCALE N 02,TLEMCEN,13,,
13-226,11192,pdv,PDV  BOUMEDIOU SETTI,TRANCHE OUDJLIDA GROUP A ET B LOCALE N 02 LOTISSEMENT 1132,TLEMCEN,13,,
13-227,11193,pdv,PDV  GHANAMA AHMED,HAI BAB ZIR N04DERB EL MASDOUD RUE GHEZLAOUI ABDESSELAM LOTISSEMENTS A,TLEMCEN,13,,
13-228,11194,pdv,PDV  BOUSSAFI ZOHEIR,RUE DERAR ABDERRAHMANE N11 EL KIFFANE 2EM TRANCHE LOTISSEMENT 151,TLEMCEN,13,,
13-229,11195,pdv,PDV  SEBBANE NADJIB,EL KIFFANE TRANCHE 113 LOTISSEMENT N125 TRANCHE N03,TLEMCEN,13,,
13-230,11196,pdv,PDV  MESLI PHONE,LOCALE N 02RUE HAMSSALI SAYEH MILOUD N 21 LOTISSEMTE 205 N 12,TLEMCEN,13,,
13-231,11197,pdv,PDV  HASSOUN MOHAMMED,KALAA SUPERIEUR LOCALE N 02,TLEMCEN,13,,
13-232,11198,pdv,PDV  MOKRI AHMED,LOCALE N 05 RUE HAMSSALI SAYEH LOTISSEMENT N101 TRANCH 204,TLEMCEN,13,,
13-233,11199,pdv,PDV  PACHA COM,N 07 RUE DOCTEUR DAMARDJI,TLEMCEN,13,,
13-234,11200,pdv,PDV  HENAOUI MOKHTAR,PLACE AMIR ABDELKADER RUE IDRIS N69,TLEMCEN,13,,
13-235,11201,pdv,PDV  ZENAGUI MOHAMMED,RESIDENCE MOUSSA BEN NASSIR LOCALE N 02 BATIMENT A02,SABRA,13,,
13-236,11202,pdv,PDV  HABI ZAKARIYA,MAISON N 05 RUE AMRAOUI ABDELKADER LOCALE N01,AIN GHORABA,13,,
13-237,11203,pdv,PDV  HALAB KAMEL,N 66 BIS 01 OUDJLIDA GROUP D ABOU TACHFINE,TLEMCEN,13,,
13-238,11204,pdv,PDV  BENYAHIA NABIL,SIDI SAID LOTISSEMENT 126 GROUPE N 04 LOCALE A,TLEMCEN,13,,
13-239,11205,pdv,PDV  BOUDALI KARIM,RUE DERAR ABDERRAHMANE N13 3EM TRANCHE EL KIFFANE,TLEMCEN,13,,
13-240,11206,pdv,PDV  BENMOSTEFA CHAKIB,27 C RUE KORTI ABDELHAMID,TLEMCEN,13,,
13-241,11207,pdv,PDV  SARI MOHAMMED SID AHMED,LOCALE 02 N19 BOULVARD AISSA BEN DIBOUNE,TLEMCEN,13,,
13-242,11208,pdv,PDV  BENYOUB MOUNIR,RUE DRARE ABDERRAHMANE N B01,TLEMCEN,13,,
13-243,11209,pdv,PDV  SELKA MOHAMMED AMINE,RUE BOUKLI HASSANE ET CHAOUI BOUDGHENE,TLEMCEN,13,,
13-244,11210,pdv,PDV  OUALI OMAR,HAI 268 LOGEMENT PARTICIPATIF BT F02 OUDJLIDA ABOU TACHFINE GROUP A0 N215,TLEMCEN,13,,
13-245,11211,pdv,PDV  DJEMLI ALI,BEN SABEUR EL KHIARI REZ DE CHAUSSEE LOCALE N 01 LOTISSEMENT 106,MAGHNIA,13,,
13-246,11212,pdv,PDV  BENNEZAIR SAADIA,HAI 05 JUILLET,SIDI DJILALI,13,,
13-247,11213,pdv,PDV  BENSLIMANE ABDELHAKIM,LOCALE 01HAI DAHOU BOUMEDIENE,SEBDOU,13,,
13-248,11214,pdv,PDV  KEBICHE SABRINA,ZAHRA FACE LA ROUTE DEPARTEMENTALE N46,AZAILS,13,,
13-249,11215,pdv,PDV  BENDELLAA BILLAL,HAI EL BEY MILOUD DERMEM,SEBDOU,13,,
13-250,11216,pdv,PDV  BAROUDI MOHAMED A1.,LOCALE N01 RUE 1 NOVEMBRE,SEBDOU,13,,
13-251,11217,pdv,PDV  ATTOUM ILYAS,LOCALE N02 RUE MARTYRE LATI HADJ AHMED,TLEMCEN,13,,
13-252,11218,pdv,PDV  MEKKI ZOHRA EP ABIB,RUE DNS BT S8 N 10 LOTISSEMENT 16,SEBDOU,13,,
13-253,11219,pdv,PDV  BAROUDI YAHIA,RUE 1 NOVEMBRE,SEBAA CHIOUKH,13,,
13-254,11220,pdv,PDV  BELYAGOUBI NOUREDDINE,LOCALE N01 RUE EL KODS,SEBDOU,13,,
13-255,11221,pdv,PDV  BELBACHIR ABDELKRIM,RUE AMIR ABDELKADER,SEBDOU,13,,
13-256,11222,pdv,PDV  YAZID MOULOUD,HAI LE MARTYRE BOUANANI HOUCINE LOCALE N01,SEBDOU,13,,
13-257,11223,pdv,PDV  SACI IBRAHIM,RUE DE LA PALESTINE LOCALE N02,SEBDOU,13,,
13-258,11224,pdv,PDV  GUALOUL MUSTAPHA,RUE LE MARTYRE BEY MILOUD LOCALE N 01 N 04,SEBDOU,13,,
13-259,11225,pdv,PDV  HEDDI ABOU BAKR,LOCALE 01RUE KASTOR,SEBDOU,13,,
13-260,11226,pdv,PDV  AOUNALLAH IBRAHIM,BENI BOUBLANE LOCALE 02,MANSOURAH,13,,
13-261,11227,pdv,PDV  CHIKHAOUI MOURAD,ROUTE NATIONAL N22 LOCALE COMMUNALE N04 TERNI CENTRE,TERNI BENI HEDIEL,13,,
13-262,11228,pdv,PDV  YOUSSEFI MOHAMMED AMINE,EL ABED LOCALE N01,EL BOUIHI,13,,
13-263,11229,pdv,PDV  ZAOUI MOHAMMED,HAI 50 LOGEMENT ACOTE ROUTE 1 NOVEMBRE LOCALE N 02,NEDROMA,13,,
13-264,11230,pdv,PDV  BENYACOUB KARIMA,LOCALE N 01DEMNA EL FAHS,BENI SNOUS,13,,
13-265,11231,pdv,PDV  CHERIFI AHMED BENMILOUD,LOCALE 02RUE DES MARTYRES,EL ARICHA,13,,
13-266,11232,pdv,PDV  BELABBAS LAREDJ,RUE DES MARTYRES,EL ARICHA,13,,
13-267,11233,pdv,PDV  KHELIFA MOHAMMED,RUE DES MARTYRES,EL ARICHA,13,,
13-268,11234,pdv,PDV  BENARRADJ LAHCEN,02 CENTR VILLE EL ARICHA,EL ARICHA,13,,
13-269,11235,pdv,PDV  MATLOUS IBRAHIM,ROUTE EL ABED EN FACE MOSQUEE ABADIR EL AGHAFARI EL KHAMIS,BENI SNOUS,13,,
13-270,11236,pdv,PDV  MAHREZ ABDELMADJID,EL KHAMIS BENI SENOUS,BENI SNOUS,13,,
13-271,11237,pdv,PDV  HAMMOUDI LAHCENE,LOCALE N 01 ZAHRAT AZAILS,AZAILS,13,,
13-272,11238,pdv,PDV  LABIAD BELKACEM,A COTE DE LA PC AIN GHORABA,AIN GHORABA,13,,
13-273,11239,pdv,PDV  SEBIH MOHAMMED ILIES,RUE SAIME ABDELKADER N06 COMMUNE SABRA,SABRA,13,,
13-274,11240,pdv,PDV  LARBI AHMED,RUE MOUSSA NASER N25 BLOC A06 COMMUNE SABRA,SABRA,13,,
13-275,11241,pdv,PDV  BENHAMED ABDELLAH,OUED ZITOUN COMMUNE SABRA,SABRA,13,,
13-276,11242,pdv,PDV  BELBACHIR AHMED,RUE ARABI AHMED LOCALE DOUZIEM N346 MKARER COMMUNE SABRA,SABRA,13,,
13-277,11243,pdv,PDV  ABBAD SOUFYANE,RUE CENTRE VILLE RUE AKID AMIROUCHE N 05 LOTICEMENT N70 N211 COMMUNE MAGHNIA,MAGHNIA,13,,
13-278,11244,pdv,PDV  GSM BENKHALED ISSAM,RUE AMIR ABDELKADER N 273 N 03 COMMUNE SABRA,SABRA,13,,
13-279,11245,pdv,PDV  BENTAHAR FETHI,RUE N 05 JUILLIET COMMUNE SABRA,SABRA,13,,
13-280,11246,pdv,PDV  MAHLIA YOUNES,LOCALE N02 RUE ABOU EL HASSAN LOTICEMENT N 046 N 086 COMMUNE REMCHI,REMCHI,13,,
13-281,11247,pdv,PDV  MILOUDI YAMINA,87LOTICEMENT BELGHAFER LOCALE N01 SABRA,SABRA,13,,
13-282,11248,pdv,PDV  HADDOUCHE ABDELHADI,RUE ARBI BEN MHIDI COMMUNE REMCHI,REMCHI,13,,
13-283,11249,pdv,PDV  ZEDDOUN HADJ,RUE AKID LOTFI N C07 COMMUNE REMCHI,REMCHI,13,,
13-284,11250,pdv,PDV  LAHCINE ILYES,RUE DARI EL OUASSINI LOTICEMENT N71 LOCALE N01 COMMUNE MAGHNIA,MAGHNIA,13,,
13-285,11251,pdv,PDV  BOUCIF HOCINE,RUE MALECK N 94 LOTICEMENT 129 LOCALE N01 COMMUNE REMCHI,REMCHI,13,,
13-286,11252,pdv,PDV  ZEDDOUN HOUCINE,RUE MOHAMMED KHMISTI LOCALE N02 COMMUNE REMCHI,REMCHI,13,,
13-287,11253,pdv,PDV  HOCINE SIDI MOHAMMED EL AMINE,LOCALE N 01 CHAMEL GHERBI N83 N050 COMMUNE REMCHI,REMCHI,13,,
13-288,11254,pdv,PDV  BOUAZZA BERRAHOU FATIMA ZOHRA EP BOUAZZA,RUE FRERE AYAD LOCALE N 02 COMMUNE REMCHI,REMCHI,13,,
13-289,11255,pdv,PDV  BENGRINE FAKHR EDDINE,LOCALE N02 ABOUHOCINE MELKIA 058 N085 COMMUNE REMCHI,REMCHI,13,,
13-290,11256,pdv,PDV  BELMAHI BENAMAR,RUE AKID LOTFI COMMUNE REMCHI,REMCHI,13,,
13-291,11257,pdv,PDV  BENMANSOUR MOHAMMED,LOCALE N 01 COMMUNE BTEM N91 RUE G COMMUNE MAGHNIA,MAGHNIA,13,,
13-292,11258,pdv,PDV  NEDJARI FETH ALLAH,RUE ARBI BEN MHIDI LOCALE N02 REMCHI,REMCHI,13,,
13-293,11259,pdv,PDV  BERCISSE SAMIRA,LOGMENT L13 N213 LOTICEMENT N11 LOCALE 01 COMMUNE REMCHI,REMCHI,13,,
13-294,11260,pdv,PDV  NOUALI NABIL,N01 RUE CHIKH BELHADJ RUE BERZAIM LOCALE 01 REMCHI,REMCHI,13,,
13-295,11261,pdv,PDV  NACER MOHAMMED,RUE BEN MOUSA MOHAMMED N111 LOCALE N 02 N06 REMCHI,REMCHI,13,,
13-296,11262,pdv,PDV  TADJOURI MOSTEFA,RUE SI MARBEH N05 COMMUNE REMCHI,REMCHI,13,,
13-297,11263,pdv,PDV  BELMAHI NOURINE,RUE ARBI BEN MHIDI COMMUNE REMCHI,REMCHI,13,,
13-298,11264,pdv,PDV  ZOUICHEN ALI,COMMUNE BKHATA N01 COMMUNE MAGHNIA,MAGHNIA,13,,
13-299,11265,pdv,PDV  GUENAD MOHAMMED AMINE,RUE OUJDA N01 COMMUNE MAGHNIA,MAGHNIA,13,,
13-300,11266,pdv,PDV  BELMIR ABDELKADER,RUE BEN BADIS RUE ARBI TBESSI N04 COMMUNE MAGHNIA,MAGHNIA,13,,
13-301,11267,pdv,PDV  MECHEBBEK BENAMAR,RUE AMIR ABDELKADER N 55 COMMUNE MAGHNIA,MAGHNIA,13,,
13-302,11268,pdv,PDV  HERIR YASSINE,N13 RUE BEN RACHED LOCALE 12 COMMUNE MAGHNIA,MAGHNIA,13,,
13-303,11269,pdv,PDV  KHABLI MOHAMMED,LOCALE N03 PREMIER RUE CENTE VILLE 215 COMMUNE REMCHI,MAGHNIA,13,,
13-304,11270,pdv,PDV  GHERMAOUI FARID,LOCALE N 02 RUE BENAMAR N A12 COMMUNE MAGHNIA,MAGHNIA,13,,
13-305,11271,pdv,PDV  BACHIRI FOUZIA EP BENHAMOU,LOCALE N 02 RUE AMIR ABDELKADER N 48 COMMUNE MAGHNIA,MAGHNIA,13,,
13-306,11272,pdv,PDV  MANSOURI OUASSINI,LOCALE N02 RUE FATH 144 LOTICEMENT N 44 COMMUNE MAGHNIA,MAGHNIA,13,,
13-307,11273,pdv,PDV  OURIBA ABDELHAFID,LOCALE N01 RUE DRARI N193 LOTICEMENT N89 MAGHNIA,MAGHNIA,13,,
13-308,11274,pdv,PDV  HAMDOUNI M AHMED,LOCALE MKARERE RUE EL MATMAR N01 RUE SGHER COMMUNE MAGHNIA,MAGHNIA,13,,
13-309,11275,pdv,PDV  NEDROMI ABDELKADER,LOCALE N01 RUE MATMER 190 N124 COMMUNE MAGHNIA,MAGHNIA,13,,
13-310,11276,pdv,PDV  ELHAMDI FATIHA,RUE ZEHOUR N02 LOTICEMENT 135 LOCALE 01 COMMUNE MAGHNIA,MAGHNIA,13,,
13-311,11277,pdv,PDV  FATIMA ZOHRA,LOTISSEMENT N 02 VILLAGE AIN NEKROUF,AIN NEHALA,13,,
13-312,11278,pdv,PDV  BOUAZZA ABDERREZAK,RUE TAFNA N 197 LOTICEMENT N 27 LOCALE LOGEMENT C COMMUNE MAGHNIA,MAGHNIA,13,,
13-313,11279,pdv,PDV  HADDOUCHE SOUFYANE,RUE LES OULIVIER LOGEMENT C202 LOTICEMENT N05 COMMUNE MAGHNIA,MAGHNIA,13,,
13-314,11280,pdv,PDV  HAMED ABDEL ILLAH,RUE N201 LOTICEMENT N01 COMMUNE MAGHNIA,MAGHNIA,13,,
13-315,11281,pdv,PDV  REFROUFI ADNANE,RUE GHABET LOCALE N01 N09 COMMUNE MAGHNIA,MAGHNIA,13,,
13-316,11282,pdv,PDV  KHALDOUN MOHAMMED,N18 RUE MOKRANI N16 N128 LOTICEMENT 213 MAGHNIA,MAGHNIA,13,,
13-317,11283,pdv,PDV  TABTI FOUZI,RUE EL FATH LOTICEMENT196 LOCALE COMMUNE MAGHNIA,MAGHNIA,13,,
13-318,11284,pdv,PDV  SMAIL MEHDI MANSOUR BELLAH,RUE EL FETH N196 LOTICEMENT N18 LOCALE N03 MAGHNIA,MAGHNIA,13,,
13-319,11285,pdv,PDV  BOUHMIDI ISMAIL,RUE EL MADBAHA 213 LOTICEMENT N32 LOCALE 01 COMMUNE MAGHNIA,MAGHNIA,13,,
13-320,11286,pdv,PDV  DERGAOUI ABDENEBI,LOCALE N01 RUE CENTRE VILLE 210 N01 MAGHNIA,MAGHNIA,13,,
13-321,11287,pdv,PDV  BOUSSETTAOUI ABDELKADER,SIDI EL MACHHOUR COMMUNE HAMMAM BOUGHRARA,HAMMAM BOUGHRARA,13,,
13-322,11288,pdv,PDV  KHALOUI DJAMAL,30RUE AKID CHAOUI MAGHNIA,MAGHNIA,13,,
13-323,11289,pdv,PDV  BENNI KHALID,LOCALE N 03 RUE LES OULIVIER VN203 LOTICEMENT 117 COMMUNE MAGHNIA,MAGHNIA,13,,
13-324,11290,pdv,PDV  CHABANE NADIA,RUE FELLAOUSENE N116 RUE FATH LOCALE 03 COMMUNE MAGHNIA,MAGHNIA,13,,
13-325,11291,pdv,PDV  AMEZIANE MOURAD,RUE N10 RUE KODS LOCALE N02 COMMUNE MAGHNIA,MAGHNIA,13,,
13-326,11292,pdv,PDV  BENMANSOUR SALEM,N 08 RUE BTEM B L N35 COMMUNE MAGHNIA,MAGHNIA,13,,
13-327,11293,pdv,PDV  BENAHMED DJAMILA,RUE CHAHIDLOTICEMENT N03 COMMUNE MAGHNIA,MAGHNIA,13,,
13-328,11294,pdv,PDV  BEYOUD SOMIA,LOCALE N01 LOTICEMENTE DOUZIEM RKIZA N 88 COMMUNE HAMMAM BOUGHRARA,HAMMAM BOUGHRARA,13,,
13-329,11295,pdv,PDV  AISSAOUIA ABDELHAFID,N02 RUE JADID LOCALE N02 COMMUNE BOUHLOU,BOUHLOU,13,,
13-330,11296,pdv,PDV  AZZI DRISS,03 ECILE DERGAOUI BENOUDA COMMUNE BOUHLOU,BOUHLOU,13,,
13-331,11297,pdv,PDV  LOUAKED YOUSRA,CENTRE BNI MASTER N01 COMMUNE BNI MASTER,BENI MESTER,13,,
13-332,11298,pdv,PDV  SNOUCI ABDERRAHIM,LOCALE N01 HAMROUN COMMUNE BNI MASTER,BENI MESTER,13,,
13-333,11299,pdv,PDV  MEKNI FETHI,ZWIA LOCALE N02 COMMUNE BNI BOUSSAID,BENI BOUSSAID,13,,
13-334,11300,pdv,PDV  GUERGABOU MOHAMMED,LOCALE N01 ZWIA COMMUNE BNI BOUSSAID,BENI BOUSSAID,13,,
13-335,11301,pdv,PDV  BOUARICHA MERYEM,LOCALE N01 RUE HAMMOU MOHAMMED COMMUNE AIN YOUCEF,AIN YOUCEF,13,,
13-336,11302,pdv,PDV  BELLADGHAM YOUCEF,N 177 LES FRERE LOCALE N02 COMMUNE AIN YOUCEF,AIN YOUCEF,13,,
13-337,11303,pdv,PDV  BENDERMEL SID AHMED,LOCALE N01 RUE AKID LOTFI N 36 COMMUNE AIN YOUCEF,AIN YOUCEF,13,,
13-338,11304,pdv,PDV  BERRAHOU HACHEMI,RUE 17 JUIN COMMUNE AIN YOUCEF,AIN YOUCEF,13,,
13-339,11305,pdv,PDV  OUICI PHONE,N48 SECTION OUDJLIDA ABOU TACHFINE CLASS A ET B,TLEMCEN,13,,
13-340,11306,pdv,PDV  MAABED PHONE,SECTION ELKOUDIA CITE ELMODJAHIDINE LOCAL N 2A,TLEMCEN,13,,
13-341,11307,pdv,PDV  HADJARI OMAR,LOCALE N 02 CITE SIDI BENCHIHA,SIDI DJILALI,13,,
13-342,11308,pdv,PDV  HADJ CHIKH PHONE,LOCAL N124 BATIMENT A1 CLASS 271 GROUPE 145 BOUDJLIDA,TLEMCEN,13,,
13-343,11309,pdv,PDV  YOUB PHONE,CITE ELKOUDIA N 01A,TLEMCEN,13,,
13-344,11310,pdv,PDV  BELHOUCINE PHONE,LOCAL N01 CITE ELYASMINE ABOU TACHFINE CLASS 62 TERRAIN 82,TLEMCEN,13,,
13-345,11311,pdv,PDV  RIHI PHONE,SECTION ELKOUDIA ELMODJAHIDINE LOCAL 01 N41,TLEMCEN,13,,
13-346,11312,pdv,PDV  REGUIBI PHONE,CITE ELKOUDIA N14,TLEMCEN,13,,
13-347,11313,pdv,PDV  BELKHODJA PHONE,05 CITE ABOU TACHFINE,TLEMCEN,13,,
13-348,11314,pdv,PDV  KIDARI PHONE,N43 CITE SALAH LOCAL N04 TOUNANE,SOUAHLIA,13,,
13-349,11315,pdv,PDV  MESSAOUDI PHONE,N25 RUE SAYAH MISSOUM TOUNANE N02,SOUAHLIA,13,,
13-350,11316,pdv,PDV  ZENATI PHONE,LOCAL N02 CITE BENSNAI N02 ROUTE 7A,SOUAHLIA,13,,
13-351,11317,pdv,PDV  KHEROUA PHONE,N15 ILOT 62 TOUNANE,SOUAHLIA,13,,
13-352,11318,pdv,PDV  HEBRI PHONE,SIDI IBRAHIM MEZAOUROU,SOUAHLIA,13,,
13-353,11319,pdv,PDV  DELHOUM PHONE,N24 TOUNANE,SOUAHLIA,13,,
13-354,11320,pdv,PDV  BENDJEBBOUR PHONE,TOUNANE COMMUNE SOUAHLIA,SOUAHLIA,13,,
13-355,11321,pdv,PDV  MOKHTARI PHONE,KHORIBA RUE N18 N 06 VILLAGE LOCAL N01,NEDROMA,13,,
13-356,11322,pdv,PDV  ZITOUNI AHMED,RUE CHERGUI RUE BELABES ALI N 04 COMMUNE SABRA,SABRA,13,,
13-357,11323,pdv,PDV  BENKABA PHONE,ELASSA COMMUNE NEDROMA,NEDROMA,13,,
13-358,11324,pdv,PDV  KHITER PHONE,CITE ELMAGHRIB,NEDROMA,13,,
13-359,11325,pdv,PDV  DJAIDER PHONE A1.,RUE ELMAGHRIB LOCAL N02,NEDROMA,13,,
13-360,11326,pdv,PDV  ZENATI GSM,LOCAL N03 RUE CHOHADA N20 CLASS05 TERRAIN 16,GHAZAOUET,13,,
13-361,11327,pdv,PDV  SEFRAOUI PHONE,LOCAL N02 RUE SAYAH MISSOUM N43 TOUNANE,SOUAHLIA,13,,
13-362,11328,pdv,PDV  AZZAZ PHONE,KHORIBA RUE 01 NOVEMBRE 1956 N 63,NEDROMA,13,,
13-363,11329,pdv,PDV  AZZAZ PHONE,KHORIBA ILOT 07 N20,NEDROMA,13,,
13-364,11330,pdv,PDV  BADREDDINE PHONE,BASSIN ELKHANZIRA CLASS 93 TERRAIN 66,NEDROMA,13,,
13-365,11331,pdv,PDV  BENYOUCEF PHONE,SECTION ELKHANZIRA CLASS N161 LOCAL N02,NEDROMA,13,,
13-366,11332,pdv,PDV  OUAFI PHONE,RUE 01 NOVEMBRE 1954 LOCAL N04 KHORIBA N37,NEDROMA,13,,
13-367,11333,pdv,PDV  DJAIDER PHONE,RUE BELDJILALI MILOUD LOCAL A15 N05,NEDROMA,13,,
13-368,11334,pdv,PDV  KHELIDJ PHONE,LOCAL 06 CITE ELRAMLA GROUPE 66 CLASS 32,GHAZAOUET,13,,
13-369,11335,pdv,PDV  GHELOUSSI PHONE,RUE REPUBLIQUE LOCAL N01,GHAZAOUET,13,,
13-370,11336,pdv,BOUGHAZI PHONE,RUE CHOHADAA LOCAL 03 N55,GHAZAOUET,13,,
13-371,11337,pdv,PDV  KAID PHONE,VILLAGE MOSQUEE ELSAKHRA,GHAZAOUET,13,,
13-372,11338,pdv,PDV  BENDJEBBOUR PHONE,LOCAL N02 ELASSA DARE BENFELLIH TRANCHE 02,NEDROMA,13,,
13-373,11339,pdv,PDV  RACHEDI PHONE,LOCAL N01 CLASS 037 TERRAIN N24 RUE MISSOUM SAYAH,GHAZAOUET,13,,
13-374,11340,pdv,PDV  BENALI PHONE,RUE ELMANAR,GHAZAOUET,13,,
13-375,11341,pdv,PDV  ARBANE PHONE,LOCAL N05 CITE OULED ZIRI CLASS 94 TERRAIN 06,GHAZAOUET,13,,
13-376,11342,pdv,PDV  OTMANI PHONE,CITE DARE YAGHMOURACEN SIDI AMEUR CLASS 41 TERRAIN 31 LOCAL N01,GHAZAOUET,13,,
13-377,11343,pdv,PDV  BENYAHIA PHONE,RUE MOUHOUN LARBI VILLAGE MAHREZ N38,FELLAOUCENE,13,,
13-378,11344,pdv,PDV  BEKKAYE PHONE,MARCHEE ELADJAIDJA,DJEBALA,13,,
13-379,11345,pdv,PDV  HAMMOUDI PHONE,LOCAL N06 ELBORE,DAR YAGHMORICENE,13,,
13-380,11346,pdv,PDV  RAHMI PHONE,DARE BEN SEMMOUD ELBORE,DAR YAGHMORICENE,13,,
13-381,11347,pdv,PDV  BENLALDJ PHONE,LOCAL 03 SECTION 32 AIN DEFLA,CHETOUANE,13,,
13-382,11348,pdv,PDV  HADJILA PHONE,SECTION AUTO CONSTRUCTION DEUXIEME TRANCHE N001 14,CHETOUANE,13,,
13-383,11349,pdv,PDV  HAMMOUDI PHONE,PREMIER TRANCHE PROJET 110 LOGEMENTS REZ DE CHAUSSEE BATIMENT 1,CHETOUANE,13,,
13-384,11350,pdv,PDV  TABTI PHONE,N39 SECTION OUZIDANE LOCAL N01,CHETOUANE,13,,
13-385,11351,pdv,PDV  BOUNAFER PHONE,LOCAL 22 BOUDJLIDA B3 CLASS 271 TERRAIN 809,TLEMCEN,13,,
13-386,11352,pdv,PDV  MALKI PHONE,265 A SECTION AUTO CONSTRUCTION TROISIEME TRANCHE,CHETOUANE,13,,
13-387,11353,pdv,PDV  HASSANI PHONE,LOCAL 18A CITE ELBERKOUK SAFSAF,CHETOUANE,13,,
13-388,11354,pdv,SMILI PHONE,RUE MOHAMMED ROUIGUEB N11,AIN KEBIRA,13,,
13-389,11355,pdv,PDV  LASSAR PHONE,LOCAL N02 BOUTRAK,AIN FETAH,13,,
13-390,11356,pdv,PDV  ZERGUIT,LOTISSEMENT MRIKA N 17,MARSA BEN MHIDI,13,,
13-391,11357,pdv,PDV  BOUHASSOUN,98ROUTE NATIONAL,ZENATA,13,,
13-392,11358,pdv,PDV  HOUARI,LOCALE N 03 EL GHNAINA,AMIEUR,13,,
13-393,11359,pdv,PDV  AMEL PHONE,43 BIS 01 MUTUELLE SOCIALE,MANSOURAH,13,,
13-394,11360,pdv,PDV  PDV BEKARI,LOTISSEMENT RUE EL MOUSTAKBAL 436 LOCALE 01,AIN TALLOUT,13,,
13-395,11361,pdv,PDV  CHADLI,19 SOUANI,SOUANI,13,,
13-396,11362,pdv,PDV  SAIM,LOCALE 01 CHAIB RASSOU,MARSA BEN MHIDI,13,,
13-397,11363,pdv,PDV  AHMED,CETRE COMMERCIAL SID SNOUCI,SIDI ABDELLI,13,,
13-398,11364,pdv,PDV  DJEMAI,BENI YAAKOUB,OULED RIYAH,13,,
13-399,11365,pdv,PDV  AISSA,LOCALE N 03 RUE SID ZOUIAOUI,OULED MIMOUN,13,,
13-400,11366,pdv,PDV  HODA PHONE,A64 ROUTE SIDI BELABES LOCALE N 01,OULED MIMOUN,13,,
13-401,11367,pdv,PDV  YACINE,AREBOUZ LOCALE N 01,MSIRDA FOUAGA,13,,
13-402,11368,pdv,PDV  ABID,LOTISSEMENT ZOUAD,MANSOURAH,13,,
13-403,11369,pdv,PDV  AMEL,LOTISSEMENT ZOUAD RUE 500 LOGEMENT,MANSOURAH,13,,
13-404,11370,pdv,PDV  HADOUCHE PHONE,LOCALE A BOUHANAK CHAMP DE TIR LOTISSEMENT 66,MANSOURAH,13,,
13-405,11371,pdv,PDV  NAFLI,LOCALE N 2 S RUE ARME DE LIBRATION NATIONA IMAMA,MANSOURAH,13,,
13-406,11372,pdv,PDV  BELHADI PHONE,CITE HAOUT AMEUR LOCAL 22 GROUPE 10 CLASS 77,GHAZAOUET,13,,
13-407,11373,pdv,PDV  EL HABIRI,GROUPE 3 A F5 RUE EL OUOROUD N05,MANSOURAH,13,,
13-408,11374,pdv,PDV  BOUGUETTAYA PHONE,RUE PRINCIPALE ROUTE CHETOUANE OUZIDANE ROUTE N 01 LOCAL 01,CHETOUANE,13,,
13-409,11375,pdv,PDV  BELLAHCENE,ROUTE NATIONAL,SIDI ABDELLI,13,,
13-410,11376,pdv,PDV  ABDELMOUMEN BENALI,NOUVELLE VILLE,HONAINE,13,,
13-411,11377,pdv,PDV  MOHAMMED,LOCALE N 01 SIDI DRISS,BENI KHELLAD,13,,
13-412,11378,pdv,PDV  FETHI,N 11 HONAINE CENTRE LOTISSEMENT 68,HONAINE,13,,
13-413,11379,pdv,PDV  HAMMAM PHONE,N07 CITE AUTO CONSTRUCTION CHETOUANE TROISIEME TRANCHE LOCAL N01,CHETOUANE,13,,
13-414,11380,pdv,PDV  QWIDER,N02 LOTISSEMENT N 05 RUE MOUHAMED KHMISTI LOCALE N02,HENNAYA,13,,
13-415,11381,pdv,PDV  YAHYIA,LOCALE 02 RUE SAHNOUNE BENAMAR N 28,HENNAYA,13,,
13-416,11382,pdv,PDV  HAMANI,RUE CASTORE LOCALE N 05,HENNAYA,13,,
13-417,11383,pdv,PDV  HAMICHE,N1 RU KHMISTI N 23 LOTISSEMENT KHMISTI N 02 LOCALE 02,HENNAYA,13,,
13-418,11384,pdv,PDV  HOUSSAME,RUE MOUMED KHMISTI 184 LOCALE 19,HENNAYA,13,,
13-419,11385,pdv,PDV  HADJI,N20ROUTE SIDI BELABESS,OULED MIMOUN,13,,
13-420,11386,pdv,PDV  MANSOUR,N 7 LOTISEMENT BENSEKRANE,BENSEKRANE,13,,
13-421,11387,pdv,PDV  BENZINA,RUE CITE DES JARDIN LOCALE 02,BENSEKRANE,13,,
13-422,11388,pdv,PDV  DJILALI,LOTISSEMENT LES OLIVIER LOCALE N 01,BENSEKRANE,13,,
13-423,11389,pdv,PDV BENAZZOUZ,N 231 RUE EL ARBI BEN MHIDI LOCALE N 05,HENNAYA,13,,
13-424,11390,pdv,PDV  AMIRAT,LOTISSEMENT SIDI MOUHAMEDN 57,BENSEKRANE,13,,
13-425,11391,pdv,PDV  SAIM,BORDJ ARIMA RUE 1 NOVEMBRE LOCALE N01,BENI OUARSOUS,13,,
13-426,11392,pdv,PDV  CHIKH,VILLAGE SIDI BEN DIAF,BENI OUARSOUS,13,,
13-427,11393,pdv,PDV  BOUCHAKOUR,KIOSQUE VILLAGE BORDJ ARIMA,BENI OUARSOUS,13,,
13-428,11394,pdv,PDV  BEDDIAF,SIDI BENDIAF,BENI OUARSOUS,13,,
13-429,11395,pdv,PDV  SAID,LOCALE 02 RUE MOUHAMED NAFEAA,BAB EL ASSA,13,,
13-430,11396,pdv,PDV  KHIAS,LOCALE 01 TGHEJRINE,BAB EL ASSA,13,,
13-431,11397,pdv,PDV  LALAM,BAB EL ASSA,BAB EL ASSA,13,,
13-432,11398,pdv,PDV  KHEROUCHE,BEN KRAMA,BAB EL ASSA,13,,
13-433,11399,pdv,PDV  AISSAOUI,BATIMENT A N 04 RUE 20LOGEMENT,AIN TALLOUT,13,,
13-434,11400,pdv,PDV  DAHEUR,LOCALE N 02 RUE BEN MANSOUR CHIKHI,AIN FEZZA,13,,
13-435,11401,pdv,PDV  BOUKHATEM,RUR BIROUANA LOCALE N 01,AIN FEZZA,13,,
13-436,11402,pdv,PDV  CHIKHI,AIN FEZZA,AIN FEZZA,13,,
13-437,11677,pdv,PDV  MEKELLECHE PHONE,BOUTREG LOCAL N01,AIN FETAH,13,,
13-438,11925,pdv,PDV  CHAFI PHONE,CITE ABOU TACHFINE CLASS 53 TERRAIN N219,TLEMCEN,13,,
13-439,11928,pdv,PDV  CHEKROUN OUSSAMA,LOCALE N 06EL KIFFANE RESIDENCE SALEF EL ADRAA BT A2,TLEMCEN,13,,
13-440,12117,pdv,PDV  ADDOUN PHONE,ZAOUIA RUE CHOHADAA RUE SALAH ABDELKADER LOCAL N02,GHAZAOUET,13,,
14-001,71,pdv,ZIAT MOBILE,CITE NASER N  15,KSAR CHELLALA,14,,
14-002,2319,pdv,PDV  FATEH TCOM,CITE MESRI DJILLALI N 327,TIARET,14,,
14-003,2320,pdv,BRAHIM PHONE,AVENUE HASSANI ABDELLAH,SOUGUEUR,14,,
14-004,2321,pdv,PDV MEZILI PHONE.,RUE BENSAKHRIA ABDELKADER,RAHOUIA,14,,
14-005,2322,pdv,ADDA TCOM,CITE MEZIANE CLASSE 54,DAHMOUNI,14,,
14-006,2323,pdv,PDV  CHERRAK RECHAIGHA,CITE RECHAIGHI ABDELKADER,RECHAIGA,14,,
14-007,2324,pdv,SASSI T COM,CITE ZERROUKI MOHAMED,TIARET,14,,
14-008,2325,pdv,PDV  GUERAI TELECOME,RUE EMIR ABDELKADER N 253 KIOSQUE SURE LE MARCHE,TOUSNINA,14,,
14-009,2326,pdv,PDV BENHAMADI MOHAMED,CITE BOUCHAREB NACEUR N 84,SOUGUEUR,14,,
14-010,2327,pdv,PDV  KHALDI TCOM,RUE ABDELBAKI N 01,MAHDIA,14,,
14-011,2328,pdv,PDV DJOUMI ALI,RUE ABDELKARIM,MAHDIA,14,,
14-012,2329,pdv,PDV  OUIDAH TCOM,RUE ABDELKRIM,MAHDIA,14,,
14-013,2330,pdv,CHAREF TCOM,64 3 EME TRANCHE LOTS 159,SOUGUEUR,14,,
14-014,2331,pdv,PDV  HADJAR COM,CITE ENCIEN KARMANE N 57,TIARET,14,,
14-015,2332,pdv,PDV  FARID PHONE,RUE AMIR ABDELKADER N 85,SOUGUEUR,14,,
14-016,2333,pdv,PDV  ASKEUR PHONE,RUE DU MARCHE,DAHMOUNI,14,,
14-017,2334,pdv,PDV  AOUED TCOM,RUE BOUCHAREB NACEUR N 01,SOUGUEUR,14,,
