id,code,type,name,address,commune,wilaya_code,lat,lng
01-001,2955,pdv,PDV  LIBRAIRIE GAFA ABDERRAHMANE,RUE 17 OCTOBRE CITE 20 AOUT N 03,ADRAR,01,,
01-002,4073,pdv,PDV  LIBRAIRIE TAYEBI BOUABDALLAH,RUE ELAMIER ABDELKADER CLASSE 08 GROUP LACTE 05 N 02 REGGANE,REGGANE,01,,
01-003,4079,pdv,PDV  COMM TAYEBI AHMED,CITE MOULAY ELARBI TAMENTIT,TAMENTIT,01,,
01-004,4087,pdv,PDV  TABAC BOUDJNAH AHMED,CITE 136 LOGTS EVOLUTIVE N69 REZ-DE-CHAUSSEE N01 ADRAR,ADRAR,01,,
01-005,4101,pdv,PDV  TABAC CHALAL LOUNIS,CITE 20 AOUTEN03 ADRAR,ADRAR,01,,
01-006,4133,pdv,PDV  GSM BAKADER BOUBAKR,RUE BELGHIT MOHAMMED N 03 ADRAR,ADRAR,01,,
01-007,4190,pdv,PDV  KMS BELGUIZI BACHIR,AKHENATIER OULED ALI N 02 ADRAR,ADRAR,01,,
01-008,4245,pdv,PDV  LIBRAIRIE AKABLI HASSEN,MAKAR APC LOCAL N 04 TAMEST,TAMEST,01,,
01-009,4257,pdv,PDV  LIBLAIRIE KHELATOU ABDELHAK,RUE ELAMIR ABDELKADER N16 REGGANE,REGGANE,01,,
01-010,4296,pdv,PDV  LIBRAIRIE HIBI AHMED,CITE 70 LOGTS TARKAOUI TARKAOUI N03,ADRAR,01,,
01-011,4325,pdv,PDV  TABAC KARED AOMAR,CITE 126 LOGTS RUE TILILANE CLASS 170M M149 N 01,ADRAR,01,,
01-012,4389,pdv,PDV  FROUHAT TELECOM,CITE 68 LOGTS CLASSE 20 GROUP LACT 185 N 01 ADRAR,ADRAR,01,,
01-013,4391,pdv,PDV  LIBLAIRIE KEBAILI SAIDA,KSAR BENTALHA N01 TSABIT,TSABIT,01,,
01-014,4397,pdv,PDV  LIBLAIRIE BOUFARES ALLAOUI ABDERAHMANE,CITE 100 LOGTS ELARBI BEN MHIDI N06,ADRAR,01,,
01-015,4429,pdv,PDV  LIBRAIRIE TOUADJI AHMED A6.,RUE TINILANE ADRA CLASSE 176 GROUP 58 N 02 ADRAR,ADRAR,01,,
01-016,4702,pdv,PDV  LIBRAIRIE BENAMRANI ABDELHAKIM,RUE ALLAL BELHACHEMI CLASSE 33 GROUP LACT 367 N 01 ADRAR,ADRAR,01,,
01-017,5628,pdv,PDV  LIBLAIRIE DJAFER NAIMA,ZAGLOU N02 ZAOUIET KOUNTA,ZAOUIET KOUNTA,01,,
01-018,7195,pdv,PDV  LIBRAIRIE AGUID ABDELKADER,KSAR LHMER N15 TAMESSET,TAMEST,01,,
01-019,7323,pdv,PDV  LIBRAIRIE CHERMAT MINA,TAKRAF DETAIL N50 N03 AOULEF,AOULEF,01,,
01-020,7340,pdv,PDV  GSM LOUNASSI ABDELLAH,KSAR OUELD BRAHIM N05 TIMMI,OULED AHMED TIMMI,01,,
01-021,7347,pdv,PDV  LIBRAIRIE BEKKOUCHE MOHAMED,CITE 20 AOUT SECTION DEUX PARTE 07 GROUP LACTE 52 N 03 ADRAR,ADRAR,01,,
01-022,7353,pdv,PDV  TABAC DAHBI AHMED,CITE 126 LGTS TSAHOUMI TILILANE PARTE 171 LACT 53 N 01 ADRAR,ADRAR,01,,
01-023,7395,pdv,PDV  LIBRAIRIE RACHID ZAKARYA,CITE ELARBI BENMHIDI CLASSE 32 GROUP LACTE 212 N 09 ADRAR,ADRAR,01,,
01-024,7430,pdv,PDV  LIBRAIRIE BOUMEDIANE MOHAMMED,MARCHE DINAR TAYEB ADRAR,ADRAR,01,,
01-025,7447,pdv,PDV  LIBRAIRIE MOUSSAOUI HICHAM,RUE BEN LAAROUSI MOHAMED PARTE 30 GROUP 38 N°02,ADRAR,01,,
01-026,7520,pdv,PDV  GSM KHALEF YOUSOUF,RUE KADDOUR BELITIM (CITE ELHATABA ) N33,ADRAR,01,,
01-027,7542,pdv,PDV  GSM BAICHI MOHAMMED,KSAR BOUFADI TMANTIT,TAMENTIT,01,,
01-028,7557,pdv,PDV  LIBRAIRIE DJAAFRI MOSTAPHA,LOCAL N 84 B ZAOUIT KOUNTA,ZAOUIET KOUNTA,01,,
01-029,7566,pdv,PDV  LIBRAIRIE FOURMA FATNA,N PORT 06 TAMENTANTI,TAMENTIT,01,,
01-030,7578,pdv,PDV  KIKO PHONE,CITE ELARBI BEN MHIDI CLASSE 32 G M 212 N 05,ADRAR,01,,
01-031,7801,pdv,PDV  LIBRAIRIE MAHIDDINE NOUR EL HOUDA,ENCIEN ELMANSOURIAPARTE 26 GROUP 41 N 02 OULED AHMED TIMMI,TIT,01,,
01-032,7865,pdv,PDV  LIBRAIRIE OUMRI FATNA,CITE 20 AOUT N 02 ADRAR,ADRAR,01,,
01-033,8762,pdv,PDV  LIBRAIRIE REBAI MESSAOUD,CITE ADJDID PARTE 23 GROUP LACT043N 04 AOULEF,AOULEF,01,,
01-034,8890,pdv,PDV  AKACEM TELECOM,RUE KADOUR BELITIM CLASSE 31M M25 N18A 18B,ADRAR,01,,
01-035,8999,pdv,PDV  LIBLAIRIE ABDELKRIMI AICHA,RUE OMAR BEN KHATAB N12 ZAOUIET KOUNTA,ZAOUIET KOUNTA,01,,
01-036,9157,pdv,LIBRAIRIE ABDERRAHMANE,SOUK ELTABADEL ELRIFI TIDMAYENE N03,IN ZGHMIR,01,,
01-037,9158,pdv,GSM HARMA OTHMEN,ZAOUIET KOUNTA N06,ZAOUIET KOUNTA,01,,
01-038,9159,pdv,LIBRAIRIE MOULAY OMAR,MAHALAT DJADIDA N06 TIDMAIENE,IN ZGHMIR,01,,
01-039,9161,pdv,LIBRAIRIE MOULAY AHMED,RUE OMAR BEN KHATAB N06,ZAOUIET KOUNTA,01,,
01-040,9162,pdv,GSM BENHAFID,KSAR BRENKANE N67 TSABIT,TSABIT,01,,
01-041,9212,pdv,LIBRAIRIE SEDRATI EL ALARABI,SAHET CHOUHADDA N 02 ADRAR,ADRAR,01,,
01-042,9213,pdv,PDV  TAMEUR TILECOM,01 A RUE BADJI ELMOKHTAR ADRAR,ADRAR,01,,
01-043,9214,pdv,LIBRARIE SALMI,RUE KADOUR BELIETIM PARTE 32 M M08 N 04 ADRAR,ADRAR,01,,
01-044,9215,pdv,PDV  GSM THAMEUR,RUE MILOUD BEN ALI N 04,ADRAR,01,,
01-045,9216,pdv,COM MULT GUERROUT,4B CITE SELMAN ELFARESSI ADRAR,ADRAR,01,,
01-046,9217,pdv,LIBRAIRIE SAIDI,PARTITION CITE ELGHERBI N 04 ADRAR,ADRAR,01,,
01-047,9218,pdv,LIBRAIRIE CHARI NOUREDDINE,CITE ELHATABA N 01 ADRAR,ADRAR,01,,
01-048,9219,pdv,BENCHERKI TELECOM,CITE ELBACHIR ELIBRAHIMI 40 LOGTS N03 ADRAR,ADRAR,01,,
01-049,9220,pdv,ELDJZIRA TELECOM,RUE ELARBI BEN MHIDI ADRAR,ADRAR,01,,
01-050,9222,pdv,GSM NOUARI,RUE ELARBI BEN MHIDI CITE ELHATABA N 21 ADRAR,ADRAR,01,,
01-051,9224,pdv,LIB LANSSARI,CITE 20 AOUT ADRAR,ADRAR,01,,
01-052,9225,pdv,GSM LOUNASSI,OULED BRAHIM N22 OULED AHMED TIMMI,ADRAR,01,,
01-053,9226,pdv,LIBRAIRIE TOUADJI,OUGEDIM PARTE 55M M148 N127 ADRAR,ADRAR,01,,
01-054,9227,pdv,LIBRAIRIE BENHASSI,SECTION CINQU N 02 ADRAR,ADRAR,01,,
01-055,9228,pdv,PDV GSM HAMANI FATEH,CITE ELARBI BEN MHIDI CENTRE VILLE PARTE 32GROUP LACT 213 N 01,ADRAR,01,,
01-056,9230,pdv,TALHAOUI GSM,NAHIA ELGHERBIA N 01ADRAR,ADRAR,01,,
01-057,9232,pdv,GSM SOUIDAK,OUGEDIM 01 ADRAR,ADRAR,01,,
01-058,9233,pdv,TABAC IDDER,KASER OUGDIM PARTE 55M M19 N05,ADRAR,01,,
01-059,9234,pdv,LIBRAIRIE MAKNI ABDERRAHMANE,RUE EL ARBI BEN MHIDI ADRAR,ADRAR,01,,
01-060,9235,pdv,PDV LIBRAIRIE BENABDESSADEK MOHAMMED Y.,RUE PALSTINE ELHATTABA N 01 ADRAR,ADRAR,01,,
01-061,9236,pdv,TABAC TOUDJI BOUDJEMAA,KASER OUGEDDIM PARTE 54 GROUP LACT 158 N 03 A,ADRAR,01,,
01-062,9237,pdv,LIBRAIRIE GUERROUR,PRES DE LA COOPERATIVE IMMOBILIERE DES EMPOLYER FINANCIESN16,ADRAR,01,,
01-063,9238,pdv,TABAC ALARBI LADMI AHMED,CITE 200 LOGTS REIFFI ELNAHIA ELGHERBIA N 24,ADRAR,01,,
01-064,9239,pdv,GSM HAMEDI,RUE KADOUR BELITM CITE ELHATTABA N 33A,ADRAR,01,,
01-065,9240,pdv,LIBRAIRIE BOUNAAMA,KASER ADGHA N 02 ADRAR,ADRAR,01,,
01-066,9241,pdv,PDV  KMS LAHBOUS,NIVEAU CINQ N 106 ADRAR,ADRAR,01,,
01-067,9242,pdv,PDV  GSM HADDAD,CITE ELGHERBI CLASSE 48M M02 N03,ADRAR,01,,
01-068,9243,pdv,PDV  LIBRAIRIE BEN DAHBI M,CITE 05 JUILLET CLASSE 18 GROUP LACT 06 N 03 SALI,SALI,01,,
01-069,9244,pdv,PDV  LIBRAIRIE BEN DAHBI,BAB ALLAH N 04 SALI,SALI,01,,
01-070,9245,pdv,PDV  ABABOU COM,RUE EMAMIR ABDELKADER REGGANE,REGGANE,01,,
01-071,9246,pdv,PDV  GSM KHELATOU,RUE ELAMIR ABDELKADER N70 REGGANE,REGGANE,01,,
01-072,9247,pdv,PDV  LIBRAIRIE LAHACHAMI S,CITE AAMENAT N 03 AOULEF,AOULEF,01,,
01-073,9248,pdv,PDV  GSM TABET ABDELKRIM,ELREKINA N 10 AOULEF,AOULEF,01,,
01-074,9249,pdv,PDV  LIBRAIRIE BAGLAB ALI,CITE ADJEDID N 02 AOULEF,AOULEF,01,,
01-075,9250,pdv,PDV  LIBRAIRIE HADDI MOHAMMED,INER N 48 TAMEKTEN,TAMEKTEN,01,,
01-076,9251,pdv,PDV  LIBRAIRIE FERHAT HADJ YOUCEF,LA PLACE DES MARTYRS N 10 ADRAR,ADRAR,01,,
01-077,9252,pdv,PDV  GSM BENMADANI ABDELRAHIM,ZAOUIT HAINOUN N 58 AOULEF,AOULEF,01,,
01-078,9253,pdv,PDV  BELAIDI TELECOM,RUE KADOUR BELIETIM ADRAR,ADRAR,01,,
01-079,9254,pdv,PDV  LIBRAIRIE MEHRI IDIR,RUE MOHAMED ELATCHANE CLASSE 30 LACTE 79 N11,ADRAR,01,,
01-080,9255,pdv,PDV  LIBRAIRIE TOUDJI AHMED,KASER ADGHA CLASS 58M M66 N27,ADRAR,01,,
01-081,9258,pdv,PDV  LIBLAIRIE KTIBE MOHAMMED,KSAR LAMAIZE N02 TSABIT,TSABIT,01,,
01-082,9264,pdv,PDV  CHATEAU TELECOM,TAKERRAF 18 LOGEMENT AOULEF,AOULEF,01,,
01-083,9527,pdv,PDV  LIBRAIRI MEKKAOUI,LOCAL N 07 ARAKSHACH AKABLI,AKABLI,01,,
01-084,9528,pdv,PDV  LIBRAIRIE DAOUDI HOUARIA,LOCAL N 01 TAMEST,TAMEST,01,,
01-085,9529,pdv,PDV  LIBRAIRIE ELBERRICHI KH,BAB ELLAH SALI,SALI,01,,
01-086,9530,pdv,PDV  LIBRAIRIE LAKSACI HASSAN,CITE ELMANSOUR PARTE ARAKCHACH N 03 AKABLI,AKABLI,01,,
01-087,9539,pdv,PDV  GSM TAYEBI AHMED,CITE MOULAY LARBI COMMUNE DE TAMENTIT,TAMENTIT,01,,
01-088,9541,pdv,PDV  LIBLAIRIE TARGA DJEMAA,OUAJLANE N32 TSABIT,TSABIT,01,,
01-089,9679,pdv,PDV  LIBLAIRIE BEN SMAIL ABDESSLAM,ZAOUIET KOUNTA,ZAOUIET KOUNTA,01,,
01-090,9691,pdv,PDV  NOUR PHONE,RUE ELARBI BEN MHIDI N 8S ADRAR,ADRAR,01,,
01-091,9708,pdv,PDV  LIBLAIRIE SMAILI FATTOUMA,ZAOUIET KOUNTA N01,ZAOUIET KOUNTA,01,,
01-092,9717,pdv,PDV  LIBRAIRIE OMARI MOHAMMED,CITE BELGHIT MOHAMMED ADRAR,ADRAR,01,,
01-093,9718,pdv,PDV  LIBRAIRIE NOUARI RACHID,CITE 30 LOGTS K N 01 OULED ALI ADRAR,ADRAR,01,,
01-094,9732,pdv,PDV  GSM FERHAT AMAR,MARCHE DINAR TEYEB,ADRAR,01,,
01-095,9736,pdv,PDV  LIBLAIRIE BAJINE MERIAMA,ZAOUIET KOUNTA SONTER N24,ZAOUIET KOUNTA,01,,
01-096,9739,pdv,PDV  GSM FINDOU ABDERRAHIM,CITE 48 LOGTS TINOULAF ELDJADID N 1 B REGGAN,REGGANE,01,,
01-097,9743,pdv,PDV  LIBRAIRIE AICHAOUI FATIHA,CITE GRAOUI AHMED CLASSE 02 GROUP LACT 193 N 02,ADRAR,01,,
01-098,9758,pdv,PDV  GSM OTHMANI JELEL,CITE 20 LOGTS N 09 AOULEF,AOULEF,01,,
01-099,9759,pdv,PDV  LIBLAIRIE BENABDERRAHMANE Y,CITE 126 LOGTS COOPIRATIF TILILANE CLASSE 170 N05,ADRAR,01,,
01-100,9790,pdv,PDV  LIBRAIRIE SEDIDIKI F,CITE 126 LOGTS COVALENTES TILILANE N° 01 ADRAR,ADRAR,01,,
01-101,9793,pdv,PDV  LIBRAIRIE MOUSSA ABDELGHANI,RUE MOHAMMEDELATCHANE CLASSE30 LACT 79 N 13,ADRAR,01,,
01-102,10137,pdv,PDV  LIBRAIRIE LAKSACI FATMA,CITE ABDELHALID BEN BADIS 40 LOGTS CLASSE 42 GROUP LACTE 27 N 09 G,ADRAR,01,,
01-103,10153,pdv,PDV  LIBLAIRIE REGGADI ISSAM,CITE ELGHARBI N01 ADRAR,ADRAR,01,,
01-104,10174,pdv,PDV  LIBRAIRIE ELKHARRAZ MOUSTAPHA,CENTRE D ECHANGE RURAL N 04 TIT,TIT,01,,
01-105,11724,pdv,PDV  COMM KHALIFA MEBARKA,BEN DRAAOU CLASS 30 GROUP LACTE 72 N 01 BOUDA,BOUDA,01,,
02-001,12,pdv,KAIBOU  DJAMEL,RUE  EL AKID  AMIROUCHE,OUED FODDA,02,,
02-002,13,pdv,ELHARATI MOHAMMED,RUE ELAMIR AEK N12 SIDI AKKACHA,SIDI AKKACHA,02,,
02-003,14,pdv,BENDAOUD MOHAMED SALAHEDDINE,CITE 52 LOGEMNETBLOC C  N05 CHLEF,CHLEF,02,,
02-004,15,pdv,CHEHAIMA IBRAHIM,HAY SERBAH LOCAL D SENDJAS,SENDJAS,02,,
02-005,23,pdv,LAFRESS FADILA,CITE BEN HLIMA CLASS 110 GROUPE 123,CHLEF,02,,
02-006,24,pdv,BOUDALI DJAMAL,CITE COOPERATIF N 02 LOCAL N 05,ZEBOUDJA,02,,
02-007,25,pdv,GSM HABRI ELAID,HAY ELHORIA N33 CLASSE 32 GROUP 176,CHLEF,02,,
02-008,26,pdv,GSM BELHACHEMI FARID,HAY ELHORIA N03 CHLEF,CHLEF,02,,
02-009,32,pdv,GSM MESSAOUD MOHAMED,CITE MARCHE ROUTENATIONAL N04 OUED SLY,OUED SLY,02,,
02-010,39,pdv,AKEL MOHAMED,ZONE 04 N 02 CONSTRUCTION DURE,CHETTIA,02,,
02-011,57,pdv,AIT HAMOUDA MAHAMMED SELIM,RUE SI BELAID C OUED FODDA,OUED FODDA,02,,
02-012,73,pdv,ALI TALEB ALI,CITE 136 LOGEMENT BLOC S N06 CHLEF,CHLEF,02,,
02-013,74,pdv,BELKACEM DJILALI,BOULVARD AIT DJIDA MILOUD,TENES,02,,
02-014,75,pdv,CHENOUNA ELHADJ,CITE 192 LOGEMENT N02 AIN MERANE,AIN MERANE,02,,
02-015,76,pdv,ZOURGUI ABDERRAHMANE,CITE BENI OUDRENE SENDJAS,SENDJAS,02,,
02-016,107,pdv,GSM BENOUALI MOHAMED,HAY BENSOUNA 160 LSP CHLEF,CHLEF,02,,
02-017,125,pdv,MORCELI FATMA EP BEDERIAT,CHLEF CENTRE PLACE DE SOLIDARITE N 08,CHLEF,02,,
02-018,138,pdv,GUENDEZ CHARIF,ZONE B01 N334LOCAL N01,CHETTIA,02,,
02-019,144,pdv,RIHI ABDELHAKE,RUE ZENATI ABDELKADER MOUSADEK,EL MARSA,02,,
02-020,145,pdv,ZERROUKI   BILAL,HAY BOUZOTTATE  RN 04 CLASSE 44 N58OUED SLY,OUED SLY,02,,
02-021,158,pdv,BOUAKEL  AHMED,HAY MOHAMED ABOUCHE  SOBHA,SOBHA,02,,
02-022,178,pdv,ZEROUR AHMED,OULED FARES CENTRE LOCAL E N98,OULED FARES,02,,
02-023,183,pdv,BOUZIANE HAFIDH,RUE BENZAMIA ELHADJ N14,ZEBOUDJA,02,,
02-024,189,pdv,MAMMAR EL HADJ  NOUREDDINE,HAY BOURIACHE  ABDELKADER  AIN MERANE,CHLEF,02,,
02-025,214,pdv,GSM BELABED MEFTAH,HAY NASER N36 ZEBOUDJA CHLEF,ZEBOUDJA,02,,
02-026,215,pdv,SAMET LAID,CITIE NOIDEURE RUE SEDAKI AEK N109,OUED FODDA,02,,
02-027,220,pdv,GSM HOUARI ABDELKADER,HAY ABBAS ELHADJ LOCAL N5B TADJENA,TADJENA,02,,
02-028,221,pdv,GSM CHEDJARI ELMEUR MOHAMMED,RUE MAKHLOUF ABDELKADER BENI HAOUA CENTRE N37,BENI HAOUA,02,,
02-029,236,pdv,KLOUCHE KHELIFA,RUE  IBNE ROCHDE CHLEF,CHLEF,02,,
02-030,237,pdv,SEKAI ABELLATIF,HARCHOUNE CENTRE N498,HARCHOUN,02,,
02-031,254,pdv,BENAMOUR MOHAMED,BOCCA CHORFA  N41 CHLEF,CHLEF,02,,
02-032,255,pdv,BELAHDJI FAROUQ,ZONE B01 N347 CHETTIA,CHETTIA,02,,
02-033,256,pdv,HENNOUNI YAMINA,TAOUGRITE CENTRE N01,TAOUGRITE,02,,
02-034,260,pdv,HABIB MILOUD,RUE IBN KHALDOUNE N 15,SIDI AKKACHA,02,,
02-035,261,pdv,ABBOU HAMZA,CITE CHATTEAU DEAU AIN MERANE,AIN MERANE,02,,
02-036,265,pdv,MERAH DJAMAL,CTIE CHORFA N15 GROUP C,CHLEF,02,,
02-037,326,pdv,BELAHCENE HICHEM,RUE OFFICER DAHNANE N 63,CHLEF,02,,
02-038,397,pdv,DJELLOUL MOHAMMED,COPERATIVE DU STADE N 51 OULED FARES,OULED FARES,02,,
02-039,398,pdv,ART PHONE,RUE DES FILS KOBZILI N 71 TENES,TAOUGRITE,02,,
02-040,399,pdv,KARIM GSM,RUE ELAMIR  ABDELKADER N 19  CHLEF,CHLEF,02,,
02-041,400,pdv,KHATTAB MOHAMED,COTE DE L APC  CHLEF,CHLEF,02,,
02-042,401,pdv,LOUMI MILOUD,ANCIENNE CHEURFA N47,CHLEF,02,,
02-043,402,pdv,PDV TOUNSSI,ROUTE NATIONAL N  04 N  02 OUD FEDDA,OUED FODDA,02,,
02-044,403,pdv,TAHRAOUI  MEHDI,HAY SERBAH,SENDJAS,02,,
02-045,458,pdv,KASSOUL ABDELKADER,CITE N0 02 OUAD FOUDDA CHLEF,OUED FODDA,02,,
02-046,459,pdv,KADDOUR TAHRI MOHAMMED,HAY CHAIB EDDOUR BEN ZERFA SOBHA,SOBHA,02,,
02-047,460,pdv,BOUZIANE ABDELLAH,ZEBOUDJA CENTRE N 01 ZEBOUDJA,ZEBOUDJA,02,,
02-048,461,pdv,ABOURA TAHAR,ROUTE NATIONAL N04 N95,OUED SLY,02,,
02-049,462,pdv,LAHMER MOHAMED,HAY ELMAAMERIA N64 OUED SLY,OUED SLY,02,,
02-050,463,pdv,ABDELKADOUS ADIL,HAY EL BADER ZONE 05 N420,CHLEF,02,,
02-051,464,pdv,BENYAMINA ELHADJ,CITE 20 AOUT,OULED BEN AEK,02,,
02-052,465,pdv,KAIBOU HALIM,RUE AMIROUCHE N02,OUED FODDA,02,,
02-053,466,pdv,BERKANE YOUNES,AGRECULTURE  N06 EL ABIODH MEDJADJA,LABIOD MEDJADJA,02,,
02-054,467,pdv,ARAIBI FATMA,Rue Belahcen N 01,EL KARIMIA,02,,
02-055,468,pdv,KOUDRI BOUDJEELTHIA YOUSSEF,HAY EL HORIA  N02,CHLEF,02,,
02-056,469,pdv,ISMAIL GSM,BOUZEGHAIA CENTRE N  12 CHLEF,BOUZGHAIA,02,,
02-057,470,pdv,TAHRI MOUSSA,CHLEF CENTRE,CHLEF,02,,
02-058,471,pdv,KERROUZI BENABDELLAH,RUE LA GUER  N12,OUED SLY,02,,
02-059,487,pdv,SEBATI MOHAMED,HAY CHEGGA N 49 PART 03,CHLEF,02,,
02-060,488,pdv,FISSAH ANES,CITE CHERIFI N15 CHLEF,CHLEF,02,,
02-061,489,pdv,BOUDJEMAA MAAMAR,KARIA BOUHALOU N145,SIDI AKKACHA,02,,
02-062,566,pdv,ZENANDA LAKHAL,SIDI ABDERAHMANE CENTRE N01 SIDI ABDERRAHMANE,SIDI ABDERRAHMANE,02,,
02-063,567,pdv,TOUALBIA MOHAMED,OULED ABBAS CENTRE,OULED ABBES,02,,
02-064,568,pdv,MOKHFI  KHEIRA,CITE259 MORSEAU COMMUNE TAOUGRITE,TAOUGRITE,02,,
02-065,569,pdv,KADOUR FELLAG LALIA,ZONE 4 N05,CHETTIA,02,,
02-066,570,pdv,NEKKAZ EPS CHENOUNA,AIN   SERRAK ELHRANFA,AIN MERANE,02,,
02-067,571,pdv,REMALI AISSA,VSA CHETTIA,CHETTIA,02,,
02-068,572,pdv,BELLAHMER ELHADJ,DHAHRA CENTRE N03,DAHRA,02,,
02-069,573,pdv,ADJOUDJ BENCHERKI,CITEE BOUZETATE N16,OUED SLY,02,,
02-070,601,pdv,KERCHOUCH MOHMED,RUE SENOUCI BEN HALIMA N0 12 OUAD FOUDA,CHLEF,02,,
02-071,602,pdv,MAAMAR DJILALI DJILALI,SOBHA CENTRE W CHLEF,SOBHA,02,,
02-072,603,pdv,ABROU ELFOUDHIL,HAY SERBAH MOHAMED N24,SENDJAS,02,,
02-073,644,pdv,MEZARA SAMIR,CITE NASRN  45 C BENIARIA,BENAIRIA,02,,
02-074,670,pdv,BELKACEM ALI,CITE CHEURFA N 042,CHLEF,02,,
02-075,671,pdv,DJELLOULI MOHAMED,HAY CHETTIA ZONE 05 N567,CHLEF,02,,
02-076,672,pdv,LOUMI HOCINE,HAY NORD OUEST N25,BOUKADIR,02,,
02-077,673,pdv,SALAMA OMAR,RUE CDT BOUNAAMA N27,CHLEF,02,,
02-078,674,pdv,DJOUADI MOHAMMED,N23 OULED FARRES,OULED FARES,02,,
02-079,677,pdv,MOHAMMED MESSAOUDI ABDELKADER,AIN MRENE CENTRE,AIN MERANE,02,,
02-080,678,pdv,SIALI AMINE,RUE ELKODES N28,TENES,02,,
02-081,703,pdv,SEHIL MOHAMED,N0 02 AIN MERAN CENTRE CHLEF,AIN MERANE,02,,
02-082,711,pdv,METCHAT MAAMAR,ROUTE DE CHERCHAL,TENES,02,,
02-083,713,pdv,DJILALI AIAD RACHID,CITE CHETTIA ZONE 03 N  813,CHETTIA,02,,
02-084,714,pdv,ELBACHIR LAHCENE,HAY MOKADEM MEROUANE N845,TENES,02,,
02-085,716,pdv,HAMADA  BRAHIM,RUE BESTI DJILALI SIDI AKACHA,SIDI AKKACHA,02,,
02-086,729,pdv,BOUTOUBA ACHOUR,RUE DE REVOLUTION,OUED FODDA,02,,
02-087,741,pdv,BOUALILI YOUNES,CITE CHETTIA CHLEF,CHETTIA,02,,
02-088,768,pdv,SLIMANI NOUREDDINE,AIN MERANE CENTRE,AIN MERANE,02,,
02-089,769,pdv,RABAH ZAKARIA,HAY BEN SOUNA N113 CHLEF,CHLEF,02,,
02-090,770,pdv,MESSAR  MOHAMED,RUE EL AMIR AEK,CHLEF,02,,
02-091,792,pdv,ALI MERZOUG TAHAR,CITE FRERE BELKHAIR N0 12 BOUKADIR,BOUKADIR,02,,
02-092,793,pdv,ABER  ABED,DHAHRA CENTRE,DAHRA,02,,
02-093,806,pdv,BOUZIANE   AMEUR,COPIRATIVE N02 COTE DE LA MOSQUE DE KHALED BEN EL WALID,ZEBOUDJA,02,,
02-094,807,pdv,HAMOU ZEROUKI ELAID,OUM DROU CENTRE N13 K,OUM DROU,02,,
02-095,808,pdv,MELAH MALIKA,ZOUNE 10 N0 01 CHETTIA CHLEF,CHETTIA,02,,
02-096,831,pdv,HAMDI PHONE,OULED FARES CENTRE  OULED FARES,OULED FARES,02,,
02-097,832,pdv,REMAKI KAMEL,AIN HEMADI ELMARESA,EL MARSA,02,,
02-098,843,pdv,SEBIHI HOCINE,LOCAL B HAY SERBAH COMMUNE SENDJAS,SENDJAS,02,,
02-099,855,pdv,GSM DEBIB ABDELHALIM,CITE 120 GROUP N99 LOCAL N02 TAOUGRITE,TAOUGRITE,02,,
02-100,868,pdv,BEN HAMOU DJAMILA,TAOUGRITE CENTRE,TAOUGRITE,02,,
02-101,874,pdv,PDV CHERIFI KAMAL,RUE DE RSISTANCE LOCAL N58 OUED FODDA,OUED FODDA,02,,
02-102,882,pdv,OUAHAB KARIM,ZONE 09 N25 B CHETTIA,CHETTIA,02,,
02-103,883,pdv,ABDELGHANI GSM,OULED ABBAS N  05 OULED ABBAS,OULED ABBES,02,,
02-104,892,pdv,GSM WALID,ZONE COMMERCIALE CENTRE N  01 OULED BEN ABDELKADER CHLEF,OULED BEN AEK,02,,
02-105,897,pdv,ABK PHONE,CITE LALLA AOUDA N  398 CHLEF,CHLEF,02,,
02-106,898,pdv,MEDAH AMHAMED,HAY 52 LOG BLOC A N0 01 CHLEF,CHLEF,02,,
02-107,966,pdv,TAHAR DJEBBAR KHADIDJA,CENTRE COUMERCIALE N0 15 BOUKADIR,BOUKADIR,02,,
02-108,978,pdv,BOUNOUA DJILALI,ZONE COPIRATIVE STADE OULED FARES,OULED FARES,02,,
02-109,979,pdv,SEBIHI HOCINE,HAY SERBBAH N16 LOCAL 02 SENDJAS,SENDJAS,02,,
02-110,1006,pdv,GOUDJIL YOUSSOUF,HAY ABDELKADER MABROUKA  ELMRESA,EL MARSA,02,,
02-111,1007,pdv,KORICHI ZOULIKHA EP SOUAIHIA,ROUTE NATIONAL N 19,SIDI AKKACHA,02,,
02-112,1008,pdv,BENAISSA CHERIF MOHAMED,N02 HAY126 LOGEMENT GTAOUGRITE,TAOUGRITE,02,,
02-113,1079,pdv,SADIA NABIL,CITE OUEST N58,BOUKADIR,02,,
02-114,1080,pdv,GSM HARIZ REKIA,CITE STATION CLASSE 73 GROUPE N51 LOCAL N02,BOUKADIR,02,,
02-115,1081,pdv,GSM ELHOUARI SAMIRA,CITE FERARE ROUBINE LOCAL N07 TENES,TENES,02,,
02-116,1082,pdv,OUKID AHMED,ROUTE SENDJAS ZONE ACTIVITIE N06 B CHLEF,CHLEF,02,,
02-117,1087,pdv,GSM AICHOUNE AHMED,HAY ELHORIA CLASSE 32 GROUP 101 LOCAL N04 CHLEF,CHLEF,02,,
02-118,1962,pdv,PDV  TOURI LAHCENE,COPIRATIVE 156 N154 ABOU ELHASSANE,ABOU EL HASSEN,02,,
02-119,1963,pdv,PDV  ABAIBIA MILOUD,ABOU ELHASSANE CENTRE N01,ABOU EL HASSEN,02,,
02-120,1964,pdv,PDV  MEDJAHED GSM,RUE MEDAHI DJILALI,CHLEF,02,,
02-121,1965,pdv,PDV  CHANTAR SALAH,RUE BOUTRIG MOKHTAR N02 ABOU EL HASSEN,ABOU EL HASSEN,02,,
02-122,1966,pdv,PDV  BETTAOUI IBRAHIM,RUE BOUTRIK MOUKHTAR ABOU EL HASSEN,ABOU EL HASSEN,02,,
02-123,1967,pdv,PDV  ZOUBIDA ELAID,KALLOUL N30 COMMUNE ABO EL HASSEN,ABOU EL HASSEN,02,,
02-124,1968,pdv,PDV  LARBI GSM,CITE PREFABRIQUE N 23 KALOUL,ABOU EL HASSEN,02,,
02-125,1969,pdv,PDV  HIRECH MOHAMED,RUE MEDDAHI DJILALI LOCAL N35 CPOMMUNE ABO EL HASSEN,ABOU EL HASSEN,02,,
02-126,1970,pdv,PDV  REZIG ELHOUARI,AIN MERANE CENTRE,AIN MERANE,02,,
02-127,1971,pdv,PDV  MEDJAHDI GSM,HAY 1 IER NOVEMBRE AIN MERAINE,AIN MERANE,02,,
02-128,1972,pdv,PDV  ZENATI YOUCEF,RUE DE LA MOSQUE N02 AIN MERANE,AIN MERANE,02,,
02-129,1973,pdv,PDV  HABIB GSM,RUE 1 IER NOVEMBRE N 01 AIN MERAINE,AIN MERANE,02,,
02-130,1974,pdv,PDV  SEDDIK MOHAMED,ROUTE PRAINSIPALE AIN MERANE,AIN MERANE,02,,
02-131,1975,pdv,PDV  ALLAOUI TAHAR,CITE 52 LOGEMENT AIN MERANE,BENAIRIA,02,,
02-132,1976,pdv,PDV  GUETTAOUI SEMAIN,AIN MERANE CENTRE N148,AIN MERANE,02,,
02-133,1977,pdv,PDV  NOURINE MAAMAR HABIB,CITIE SUD N08 AIN MERANE,AIN MERANE,02,,
02-134,1978,pdv,PDV  SOUAG YOUCEF,AIN MERANE CENTRE N02,AIN MERANE,02,,
02-135,1979,pdv,PDV  GSM BENARIA,BENAIRIA CENTRE N 41 BENAIRIA ZEBOUDJA CHLEF,BENAIRIA,02,,
02-136,1980,pdv,PDV  MAABOU ABDELKADER,BENI HAOUA CENTRE N01 BENI HAOUA,BENI HAOUA,02,,
02-137,1981,pdv,PDV  ACHOUR MOHAMED,ROUTE NATIONALE N01 BENI HAOUA,BENI HAOUA,02,,
02-138,1982,pdv,PDV  KHEDIM LARBI,PREFABIQUE N204 BENI RACHED,BENI RACHED,02,,
02-139,1983,pdv,PDV  TELFOUFA GSM,BENI RACHED CENTRE,OUED FODDA,02,,
02-140,1984,pdv,PDV  ABDELLI AHMED,ROUTE NATIONAL N04 COMMUNE BOUKADIR,BOUKADIR,02,,
02-141,1985,pdv,PDV  HAMZAOUI MOHAMMED,BOUZEGHAIA CENTRE N16,BOUZGHAIA,02,,
02-142,1986,pdv,PDV  CHAOUTI GSM,STATION HMIS N 14 BOUZGHAIA,BOUZGHAIA,02,,
02-143,1987,pdv,PDV  NEBACHE MOHAMMED,LOCAL N16 BOUZEGHAIA CENTRE ROUTE NATIONALE N19,BOUZGHAIA,02,,
02-144,1988,pdv,PDV  HADJ NAAAS ABDELKADER,HAY SERBAH N08 SENDJAS,SENDJAS,02,,
02-145,1989,pdv,PDV  BELAREDJ REDWANE,AGRCULTURE N08 CHETTIA,CHETTIA,02,,
02-146,1990,pdv,PDV  BACHIR MOHAMED,ZONE DACTIVITIE N181 CHETTIA,CHETTIA,02,,
02-147,1991,pdv,PDV  DAHMANE KHALID,OULED FARES CENTRE CLASS70 GROUPE 12,OULED FARES,02,,
02-148,1992,pdv,PDV  DJELLOULI ABDELHEQ,ZONE 05 N 557 LOCAL N557 A CHETTIA,CHETTIA,02,,
02-149,1993,pdv,PDV  DELLA GSM,ZONE 04 N 199 RUE PRINCIPAL LOCAL N 02,CHETTIA,02,,
02-150,1994,pdv,PDV  DERRAR YASSINE,ZONE 11 N104,CHETTIA,02,,
02-151,1995,pdv,PDV  MAMMEUR DJILALI,RUE PRINSIPAL CHETTIA ZONE 05 N26,CHETTIA,02,,
02-152,1996,pdv,PDV  GHARBI MUSTAPHA,HAY CHETTIA ZONE N01 N224 CHETTIA,CHETTIA,02,,
02-153,1997,pdv,PDV  BOUHENNI SALAH,SENDJAS CENTRE N11,SENDJAS,02,,
02-154,1998,pdv,PDV  CHAKOURI LAID,ZONE D03 N200 CHETTIA,CHETTIA,02,,
02-155,1999,pdv,PDV  KLOUCHE KHELIFA,LA GARETIERE N05 CHLEF CENTRE,CHLEF,02,,
02-156,2000,pdv,PDV  SAHNOUNE GSM,CITE VIEUX CHORFA N106,CHLEF,02,,
02-157,2001,pdv,PDV  MEZRIG ABDELLAH,COPIRATIVE N13 OUM DROU,OUM DROU,02,,
02-158,2002,pdv,PDV  HASSOUNE SAIH,COPIRATIVE HAY ESSALEM NF11 CHLEF,CHLEF,02,,
02-159,2003,pdv,PDV  CHORFA GSM,RUE EL AMIR ABDELKADER N 22 CHLEF,CHLEF,02,,
02-160,2004,pdv,PDV  TIKELALINE MOHAMED,AGRICULTURE ELMARSA,EL MARSA,02,,
02-161,2005,pdv,PDV  LAKOUES SEYYID AHMED,723 HAY LALA AOUDA CHLEF,CHLEF,02,,
02-162,2006,pdv,PDV  BAHLOUL ALI,ROUTE NATIONALE N19 HAY 136 LOGEMENT BLOC H,CHLEF,02,,
02-163,2007,pdv,PDV  MESSAOUI ELHADJ,CITE MOUAFKIA N128,CHLEF,02,,
02-164,2008,pdv,PDV  BIG BAN FONE,RUE BEN BADISSE N 46 CHLEF,CHLEF,02,,
02-165,2009,pdv,PDV  NOUZHA COM,HAY CHERIFI KADDOUR,CHLEF,02,,
02-166,2010,pdv,PDV  SOUCHI GSM,REZ DE CHAUSSEE LAPLACE DE LA SOLIDARITE CHLEF,CHLEF,02,,
02-167,2011,pdv,PDV  DAHMANE BOUALI SAMIR,CITE CHORFA H,CHLEF,02,,
02-168,2012,pdv,PDV  CHELALI HACENE,HAY EL SALAM N 63 CLASS 1313 GROUPE 107,CHLEF,02,,
02-169,2013,pdv,PDV  BERRAH ABDELKADER,BOCCA SAHNOUNE HAY ESSALEM N66 CHLEF,CHLEF,02,,
02-170,2014,pdv,PDV  BOUGHARAB MOURAD,103 HAY EL BADR ZONE 05 CHLEF,CHLEF,02,,
02-171,2015,pdv,PDV  CHEMINI SOLEYMANE,HAY BEN ZARGA CHAIB DORLOCAL N01,SOBHA,02,,
02-172,2016,pdv,PDV  OUCHENE ELHADJ,CITE EL SALLAM N29 COMMUNE CHLEF,CHLEF,02,,
02-173,2017,pdv,PDV  RAHOU GSM,HAY ELHORIA N05 CHLEF,CHLEF,02,,
02-174,2018,pdv,PDV  LAZAAR RABIE,HAY BEN SOUNA N25 CHLEF,CHLEF,02,,
02-175,2019,pdv,PDV  TEMMAM TOUFIK,CITE MEDDAHI N87,CHLEF,02,,
02-176,2020,pdv,PDV  ABDELLAOUI MOULOUD,CITE 136 LOGMENTS BLOC G N08 COMMUNE CHLEF,CHLEF,02,,
02-177,2021,pdv,PDV  HARCHOUCHE ALI,CITE CHOURFA ZONE 03 N14,CHLEF,02,,
02-178,2022,pdv,PDV  HENNI DOUMA DJILALI,RUE BEN BADIS N03 CHLEF,CHLEF,02,,
02-179,2023,pdv,PDV  BOUNOUA AICHA,HAY BOUKAABENE N204 COPIRATIVE SOCIALE BOUKADIR,BOUKADIR,02,,
02-180,2024,pdv,PDV  NASALI AHMED,LOCAL N03 COPIRATIVE N178 N76 DHAHRA,DAHRA,02,,
02-181,2025,pdv,PDV  KECILI GSM,RUE 1 NOUVEMBRE 1954 N 20,DAHRA,02,,
02-182,2026,pdv,PDV  KHELIFAOUI GSM,EL KARIMIA CENTRE N 12,EL KARIMIA,02,,
02-183,2027,pdv,PDV  ELATSAMENIA ABDELGHANI,RUE ELHORIA LOCAL N01 ELKARIMIA,EL KARIMIA,02,,
02-184,2028,pdv,PDV  KHETTAB ABDELHAMID,RUE ELHORIA N06 ELKARIMIA,EL KARIMIA,02,,
02-185,2029,pdv,PDV  LAKROUT HOUARI,CITIE FERARE NEMMAR N25 LOCAL N01 ELKARIMIA,EL KARIMIA,02,,
02-186,2030,pdv,PDV  GHACHI RADHWAN,N26 HAY NEMMAR ELKARIMIA,EL KARIMIA,02,,
02-187,2031,pdv,PDV  CHACHOU GSM,HAT EK HORIA CITE EL KARIMIA,EL KARIMIA,02,,
02-188,2032,pdv,PDV  RAHAL QADDOUR,GROUPE AGRICOL N20 COMMUNE EL KARIMIA,EL KARIMIA,02,,
02-189,2033,pdv,PDV  CHAFAA GSM,RUE 1 NOUVEMBRE N 16 EL KARIMIA,EL KARIMIA,02,,
02-190,2034,pdv,PDV  OUAKID MAHFOUDH,ELGEULTA MAHFOUDH N 11,EL MARSA,02,,
02-191,2035,pdv,PDV  ABDEOU FATIH,EUR DE LA RESISTANCE N27 CHLEF,CHLEF,02,,
02-192,2036,pdv,PDV  CHAABANE PHONE,RUE DE RARTYRE AKEB KHALIFA HRANFA,HARENFA,02,,
02-193,2037,pdv,PDV  GUERAMZI AHMED,VILLAGE AGRICOL COMMUNE HARENFA,HARENFA,02,,
02-194,2038,pdv,PDV  BEN AYAT GSM,HARENFA CENTRE N 16,HARENFA,02,,
02-195,2039,pdv,PDV  BELHACENE FATMA,HARENFA CENTRE N59,HARENFA,02,,
02-196,2040,pdv,PDV  ELLILA HOCINE,AGRECULTURE N24 BOUZEGHAIA,BOUZGHAIA,02,,
02-197,2041,pdv,PDV  KHALOUF GSM,HAY HOUCINE BAROUDI MOSSADEK,MOUSSADEK,02,,
02-198,2042,pdv,PDV  YAGOUBI KHEIRA,LOCAL HAY ELHOMRI OUED FODDA,OUED FODDA,02,,
02-199,2043,pdv,PDV  MOUISSI MOHAMMED,RUE MIMOUNE ABDELKADER N01,OUED FODDA,02,,
02-200,2044,pdv,PDV  OUADDAK AHMED,CETE ZEBABDJA N 35 OUED FODDA,OUED FODDA,02,,
02-201,2045,pdv,PDV  SAIDI ABDLHAMID,HAY LA GARE OUED SLY,OUED SLY,02,,
02-202,2046,pdv,PDV  SAIDI GSM,CITE ROUTE NATIONAL N04,OUED SLY,02,,
02-203,2047,pdv,PDV  CHAKER MOHAMMED,CITE MOSQUE OUED SLY,OUED SLY,02,,
02-204,2048,pdv,PDV  ABDOUN CHAREF KHEIRA,HAY BOULEFRAD OUED SLY,OUED SLY,02,,
02-205,2049,pdv,PDV  DJELLOUL GSM,HAY CHORFA CHLEF,CHLEF,02,,
02-206,2050,pdv,PDV  ARBIA BOUDJELTHIA ALI,RUE AFOUNES N12 CLASSE71 GROUP 93 OULED FARES,OULED FARES,02,,
02-207,2051,pdv,PDV  ZIANI DJELLOUL,COPIRATIVE N42 CLASSE 71 N03 OULED FARES,OULED FARES,02,,
02-208,2052,pdv,PDV  BENHERAOUA GSM,CITE DES FRERES HADJ DJILALI N 11 OULED FARES,OULED FARES,02,,
02-209,2053,pdv,PDV  NOUNOU PHONE,HAY ELHORIACLASSE33 GROUP 455,CHLEF,02,,
02-210,2054,pdv,PDV  FETTAH AICHA,RUE FRERE BELABDI LOCAL N 01,OUM DROU,02,,
02-211,2055,pdv,PDV  AMAZOUZ AHMED,RUE AZOUNE ABDELKADER OUM DROU,OUM DROU,02,,
02-212,2056,pdv,PDV  BERRADIA TOUFIK,COPIRATIVE 66 GROUP 16 OUM DROU LOCAL N32,OUM DROU,02,,
02-213,2058,pdv,PDV  MOKRETAR AHMED,RUE ELAMIR ABDELKADERSIDI AKKACHA,SIDI AKKACHA,02,,
02-214,2059,pdv,PDV  HABIB MILOUD,RUE ELAMIR ABDELKADER SIDI AKKACHA,SIDI AKKACHA,02,,
02-215,2060,pdv,PDV  HABIB FONE,RUE BEN KHALDOUNE N 08 SIDI AKKACHA,SIDI AKKACHA,02,,
02-216,2061,pdv,PDV  MANSOUR ZOUBEYR,SOBHA CENTRE N01,SOBHA,02,,
02-217,2062,pdv,PDV  AKEB DAOUD SOUFIANE,HAY BEN ZERFA CHAIEB EDDOUR LOCAL N02 SOBHA,SOBHA,02,,
02-218,2063,pdv,PDV  CHEMINI NOUREDDINE,SOBHA CENTRE N 10,SOBHA,02,,
02-219,2064,pdv,PDV  GHAZA FONE,RUE MARCHER COVERT N 02 TENES,TENES,02,,
