id,code,type,name,address,commune,wilaya_code,lat,lng
19-471,12129,pdv,PDV  HAMRANI GSM,CITE HACHMI BT 12 REZ DE CHAUSSEE N 53 B 12 19 SETIF,SETIF,19,,
19-472,12130,pdv,PDV  OSMANE MOHAMED,LOTISSMENT 233 LOT N 166 CITE EL AMIR ABDELKADER LOCAL N 04 GUELLAL,GUELLAL,19,,
19-473,12131,pdv,PDV  BARA ABDALLAH,THAACHOUCHTE CENTRE TIZI N BRAHEM TALA IFACENE,TALAIFACENE,19,,
20-001,1357,pdv,PDV BACHIRI ALI,CITE FRERE FARAHI N 93 COMMUNE EL HASSASNA,EL HASSASNA,20,,
20-002,1358,pdv,PDV  NAAR ALIA,AVENUE AHMED MEDAGHRI N 36 COMMUNE SAIDA,SAIDA,20,,
20-003,1359,pdv,PDV MOKHTARI BOUZIANE,RUE AMIRE ABDELKADER LOCALE 02 COMMUNE OULED KHALED,OULED KHALED,20,,
20-004,1360,pdv,PDV  NASRI ATTOU,RUE ADLI BACHIR COMMUNE YOUB,YOUB,20,,
20-005,1361,pdv,PDV  BENRABIHA SAMIR,CENTRE BALLOUL N 132 LOT 075 N 234 COMMUNE OULED IBRAHIM,OULED BRAHIM,20,,
20-006,1362,pdv,PDV AMARI BENAOUMEUR,RUE OUIS KADDOUR COMMUNE SAIDA,SAIDA,20,,
20-007,1363,pdv,PDV BELOUFA MOHAMED,24 RUE FILLALI ABDELDJEBBAR AIN EL HADJAR,AIN EL HADJAR,20,,
20-008,1364,pdv,PDV AMAMRA LEILA EP HOUMANI,RUE KHOUDJA BELHADJ LOCAL 02 REBAHIA N 22 COMMUNE OULED KHALED,OULED KHALED,20,,
20-009,1365,pdv,PDV KHELFA MOHAMED,RUE 1 NOVEMBRE BALLOUL COMMUNE OULED IBRAHIM,OULED BRAHIM,20,,
20-010,1366,pdv,PDV NASRI MOKHTAR,YOUB CENTRE COMMUNE YOUB,YOUB,20,,
20-011,1367,pdv,PDV  BENSEKRANE MOHAMED,LOTISSEMENT N 62 BALLOUL COMMUNE OULED IBRAHIM,OULED BRAHIM,20,,
20-012,1368,pdv,PDV  OUITER KARIMA,CITE 11 DECEMBRE N 21 COMMUNE SIDI BOUBEKEUR SAIDA,SIDI BOUBEKEUR,20,,
20-013,1369,pdv,PDV  OSCAR TELECOM SAIDA,RUE DES MARTYRES N 03 LOCAL 03 EN FACE RUE OUIS KADDOUR COMMUNE SAIDA,SAIDA,20,,
20-014,1370,pdv,PDV  TAHI BELKACEM,AVENUE AHMED MEDAGHRI N 41 COMMUNE SAIDA,SAIDA,20,,
20-015,1371,pdv,PDV  MOHAMMEDI BERREZOUG,RUE BELOUFA LAKHDAR COMMUNE MOULAY EL ARBI,MOULAY LARBI,20,,
20-016,1372,pdv,PDV  LAKHDARI BENDINE,AIN SKHOUNA COMMUNE AIN SKHOUNA,AIN SKHOUNA,20,,
20-017,1373,pdv,PDV BENMAHI DAOUI,RUE ABANE RAMDHANE N 29 LOCAL 01 COMMUNE SAIDA,SAIDA,20,,
20-018,1374,pdv,PDV  DJEBIRI KADDA,KHALFALLAH A COTE DU MARCHE COMMUNE SIDI AHMED,SIDI AHMED,20,,
20-019,1375,pdv,PDV HAMIDI KHEIRA,RUE FILLALI ABDELDJEBBAR COMMUNE AIN EL HADJAR,AIN EL HADJAR,20,,
20-020,1376,pdv,PDV  AMARI KHALED,01 CITE BOUKHORS LOCAL 02 SAIDA,SAIDA,20,,
20-021,1377,pdv,PDV TIRES MUSTAPHA KAMEL,RUE BENAICHA ABDELKADER N 07 COMMUNE SAIDA,SAIDA,20,,
20-022,1378,pdv,PDV AKIL EP HARRIRI MELOUKA,ROUTE NATIONAL VERS SIDI BELABES YOUB,YOUB,20,,
20-023,1379,pdv,PDV  AIT TAYEB MOHAMMED SAID,KARIAT MOULAY EL ARBI COMMUNE MOULAY EL ARBI,MOULAY LARBI,20,,
20-024,1380,pdv,PDV AYACHI DJILLALI,LOTISSEMENT B EL MAAMORA,MAAMORA,20,,
20-025,1381,pdv,PDV ZATER ABDELOUAHAD,SIDI BOUBEKEUR COMMUNE SIDI BOUBEKEUR,SIDI BOUBEKEUR,20,,
20-026,1382,pdv,PDV KHATIR MERABET,CITE 25 LOGEMENT N 14 K SIDI MAAMAR COMMUNE AIN EL HADJAR,AIN EL HADJAR,20,,
20-027,1383,pdv,PDV  GUENAOUI MAHI,ALI MCHAREF ROUTE NATIONAL N 06 COMMUNE SIDI BOUBEKEUR,SIDI BOUBEKEUR,20,,
20-028,1384,pdv,PDV  BOUSSAID MAAMAR,CITE EL BORDJ N 19 SITUE 26 COMMUNE SAIDA,SAIDA,20,,
20-029,1385,pdv,PDV  MENI MALIKA,CITE AHMED MEDAGHRI N 44 COMMUNE SAIDA,SAIDA,20,,
20-030,1386,pdv,PDV MEBARKI LAKHDAR,CITE BOUKHORS N 138 COMMUNE SAIDA,SAIDA,20,,
20-031,1387,pdv,PDV GUENAOUI AICHA,CITE 1 NOVEMBRE COMMUNE SIDI BOUBEKEUR,SIDI BOUBEKEUR,20,,
20-032,1388,pdv,PDV  BELKHIR ABDELKRIM,AVENUE MERABET AHMED N 16 LOT N 07 COMMUNE SAIDA,SAIDA,20,,
20-033,1389,pdv,PDV BENOUIS EL KEBIR,RUE BENAICHA ABDELKADER N 03 SAIDA,SAIDA,20,,
20-034,1390,pdv,PDV DIDAOUI MOHAMED,CITE 250 LOGEMENT N 1501 LOCAL 03 COMMUNE SAIDA,SAIDA,20,,
20-035,1391,pdv,PDV MEGHERBI MOBILE,RUE BENAICHA ABDELKADER N 07 COMMUNE SAIDA,SAIDA,20,,
20-036,1392,pdv,PDV KEMOUN ABDELKADER,RUE DJEBBAR KEBIR N 10 COMMUNE SAIDA,SAIDA,20,,
20-037,1393,pdv,PDV SLIMANI ABDELKRIM,RUE 1 NOVEMBRE LOCAL 03 N 12 COMMUNE AIN EL HADJAR,AIN EL HADJAR,20,,
20-038,1394,pdv,PDV HEBBAR BRAHIM,A COTE COOPERATIVE EX ABEIL COMMUNE SIDI AMAR,SIDI AMAR,20,,
20-039,1395,pdv,PDV  NOUFEL DJOHER,CITE FERER SEDDIK LO 16 N 04 COMMUNE SAIDA,SAIDA,20,,
20-040,1396,pdv,PDV MILOUDI MOHAMED SALEH,RUE DRISS MLOUKA LOCAL 02 COMMUNE SIDI BOUBEKEUR,SIDI BOUBEKEUR,20,,
20-041,1397,pdv,PDV HOCINE ABDELATIF,AVENUE HAKIM SAADANE N 4 COMMUNE SAIDA,SAIDA,20,,
20-042,1398,pdv,PDV KHELIF RACHID,RUE 1 NOVEMBRE N 03 LOCAL 03 COMMUNE AIN EL HADJAR,AIN EL HADJAR,20,,
20-043,1399,pdv,PDV REMMAS SAMIR,CITE NASR BT D 18 N 11,SAIDA,20,,
20-044,1400,pdv,PDV  KAID NOUREDDINE,CITE 93 LOGEMENT COMMUNE MOULAY EL ARBI,MOULAY LARBI,20,,
20-045,1401,pdv,PDV ABDELLAOUI GHIAT,LOTISSEMENT 377 LOT N 247 COMMUNE AIN EL HADJAR,AIN EL HADJAR,20,,
20-046,1402,pdv,PDV MOUSSAOUI LOUNIS,MOULAY EL ARBI COMMUNE MOUALY ARBI,MOULAY LARBI,20,,
20-047,1403,pdv,PDV LASFAR MEHDI ZOHEIR,AVENUE DE LALN N 06 LOCAL 02 COMMUNE SAIDA,SAIDA,20,,
20-048,1404,pdv,PDV  DAHMANI MAHFOUD,AVENUE AHMED MEDAGHRI N 44 LOCAL 02 COMMUNE SAIDA,SAIDA,20,,
20-049,1405,pdv,PDV REMAS MOKHTAR,AIN TEGHAT COMMUNE OULED KHALED SAIDA,OULED KHALED,20,,
20-050,1406,pdv,PDV ABDELDJEBBAR MOHAMED MEDDAH,AIN SOLTANE C COMMUNE AIN SOLTANE,AIN SOLTANE,20,,
20-051,1407,pdv,PDV LARBI MOHAMED EL AMINE,CITE SALEM ILOT C 1 N 01 COMMUNE SAIDA,SAIDA,20,,
20-052,1408,pdv,PDV HADJ MOUSSA MOHAMED EL HABIB,PLACE KHEMISTI MOHAMED N 01 COMMUNE SAIDA,SAIDA,20,,
20-053,1409,pdv,PDV MOKHBI BRAHIM,RUE LAHOUEL DJILLALI N 01 LOCAL 01 REBAHIA COMMUNE OULED KHALED,OULED KHALED,20,,
20-054,1411,pdv,PDV  CHEHROURI BOUALEM,CITE 32 LOGEMENT N 01 LOCAL 05 COMMUNE SAIDA,SAIDA,20,,
20-055,1412,pdv,PDV  KHARCHI ZAKARIA,CITE SALEM 02 LOT N02A PROJET 27 LOGEMENT LSP BATIMENT B N 02 COMMUNE SAIDA,SAIDA,20,,
20-056,1413,pdv,PDV HAFSI MAHDJOUBA,RUE DJEBBAR HADJ LOCAL 03 COMMUNE SIDI AMAR,SIDI AMAR,20,,
20-057,1414,pdv,PDV BERBER MUSTAPHA,RUE BITAR ALI LOCAL 02 N 07 COMMUNE SIDI BOUBEKEUR,SIDI BOUBEKEUR,20,,
20-058,1415,pdv,PDV BELOUZ FARID,CITE 192 LOGEMENT EL BADR ILOT A N 03 COMMUNE SAIDA,SAIDA,20,,
20-059,1416,pdv,PDV  BELGRINE ABDELATIF,AVENUE FRANTZ FANON N 15 LOCAL 02 COMMUNE SAIDA,SAIDA,20,,
20-060,1417,pdv,PDV MOUICI YOUSSOUF,EL MAAMORA COMMUNE EL MAAMORA,MAAMORA,20,,
20-061,1418,pdv,PDV  LACHI FATIHA,AVENUE DE L INDEPENDANCE N 11 LOCAL 01 COMMUNE SAIDA,SAIDA,20,,
20-062,1419,pdv,PDV  MAHIEDDINE BENTABET,EL BORDJ 1 N 11 LOCAL 02 COMMUNE SAIDA,SAIDA,20,,
20-063,1930,pdv,PDV  MORSLI MOHAMED REDA,RUE FRANTZ FANON N 14 COMMUNE SAIDA,SAIDA,20,,
20-064,1931,pdv,PDV  BENABBOU KADA,RUE LAHOUEL N 09 REBAHIA COMMUNE OULED KHALED,OULED KHALED,20,,
20-065,1932,pdv,PDV  RACHEDI TOUFIK,CITE SALEM C N 03 A GAUCHE COMMUNE SAIDA,SAIDA,20,,
20-066,1933,pdv,PDV  AIBOUT BENDIDA,OUED FALIT COMMUNE MOULAY EL ARBI,MOULAY LARBI,20,,
20-067,1934,pdv,PDV  DJELLAT HOCINE,RUE MAZOUNI MOHAMED N A 1 LOCAL 02 COMMUNE SAIDA,SAIDA,20,,
20-068,1935,pdv,PDV  HABIBES HABIB,CITE 218 LOGEMENT SALEM ILOT 07 LOCAL 02 COMMUNE SAIDA,SAIDA,20,,
20-069,1936,pdv,PDV TAGUINE ABDELKADER,CITE RIADH ILOT 586 BATIMENT B02 06 N 37 COMMUNE SAIDA,SAIDA,20,,
20-070,1937,pdv,PDV  DERKAOUI MOHAMED,RUE BELARBI LAAREDJ N 03 COMMUNE SAIDA,SAIDA,20,,
20-071,1938,pdv,PDV  HELALI HALIMA,CITE BOUDRIAA MUSTAPHA 250 LOGEMENT ILOT 25 N 03 LOCAL 03 COMMUNE SAIDA,SAIDA,20,,
20-072,1939,pdv,PDV  BOUZIANE MILOUD,HOUNET CENTRE LOCAL 02 COMMUNE HOUNET,HOUNET,20,,
20-073,1940,pdv,PDV  TAHI BELKACEM A1.,RUE BESSIF AHMED N 42 RUE BABIA CHEIKH COMMUNE SAIDA,SAIDA,20,,
20-074,1941,pdv,PDV  MEGHERBI SACI,RUE FRANTZ FANON N A 1 COMMUNE SAIDA,SAIDA,20,,
20-075,1942,pdv,PDV  KHELFI TAYEB,RUE KAID BENAOUMEUR N 28 LOCAL 02 COMMUNE AIN EL HADJAR,AIN EL HADJAR,20,,
20-076,1943,pdv,PDV  BENSEKRANE MOHAMED A1,CITE SALEM 02 PAVILLION 2C N 02 COMMUNE SAIDA,SAIDA,20,,
20-077,11112,pdv,PDV  MENAD HASNIA,CITE MEDAGHRI AHMED 1 NOVEMBRE ET DAOUDI MOUSSA N 07 LOCAL 04 COMMUNE SAIDA,SAIDA,20,,
20-078,11113,pdv,PDV  NACEL BENAMAR,RUE FIDAH TAYEB ROUTE NATIONAL N 06 COMMUNE SIDI BOUBEKEUR,SIDI BOUBEKEUR,20,,
20-079,11114,pdv,PDV  BELABED DJELLOUL,RUE AHMED MEDAGHRI KHALFALLAH COMMUNE SIDI AHMED,SIDI AHMED,20,,
20-080,11115,pdv,PDV  ZIDANE ABDELKADER,CITE SAHRAOUI ABDELKADER COMMUNE YOUB,YOUB,20,,
20-081,11116,pdv,PDV  GOT SADIA EP MAATI A1.,AVENUE DES MARTYRES 04 COMMUNE SAIDA,SAIDA,20,,
20-082,11117,pdv,PDV  SERSAR NADILA,LOCAL 01 RUE BENAICHA ABDELKADER N 04 COMMUNE SAIDA,SAIDA,20,,
20-083,11118,pdv,PDV  MANSOURI BELAID,LOCAL 02 LOTISSEMENT 308 LOT CITE DALIA COMMUNE AIN EL HADJAR,AIN EL HADJAR,20,,
20-084,11119,pdv,PDV  KOBLI ABDERRAHMANE,LOTISSEMENT NAHDA 163 LOT N 78 REBAHIA COMMUNE OULED KHALED,OULED KHALED,20,,
20-085,11120,pdv,PDV  BENLAGRA MOSTEFA,CITE 05 JUILLET 436 LOGEMENT ILOT 05 N 03 COMMUNE SAIDA,SAIDA,20,,
20-086,11121,pdv,PDV  HAMRI MOHAMED,RUE ABDELLAH DJILLALI REBAHIA COMMUNE OULED KHALED SAIDA,OULED KHALED,20,,
20-087,11122,pdv,PDV  KHELEF DJAMEL,SIDI MBAREK COMMUNE AIN EL HADJAR,AIN EL HADJAR,20,,
20-088,11123,pdv,PDV  AOUINE MIMOUN,RUE ABDELLAH AHMED REBAHIA COMMUNE OULED KHALED,OULED KHALED,20,,
20-089,11124,pdv,PDV  KHALFAOUI ZOHRA EPOUSE ACHOUR,CITE EL BADRA 192 LOGEMENT ILOT D6 D06 N 01 COMMUNE SAIDA,SAIDA,20,,
20-090,11125,pdv,PDV  BOUHAFS FATIHA,CITE KERFOUF BOUDJLAL N 18 LOCAL 01 COMMUNE SAIDA,SAIDA,20,,
20-091,11126,pdv,PDV  MELOUKI MOHAMED,LOTISSEMENT 11 N 08 CCOMMUNE SIDI BOUBEKEUR SAIDA,SIDI BOUBEKEUR,20,,
20-092,11127,pdv,PDV  REFFAS MOHAMED,CENTRE AIN EL HADJAR LOT N 15 COMMUNE AIN EL HADJAR SAIDA,AIN EL HADJAR,20,,
20-093,11128,pdv,PDV  BOUBEKRI ABDELKADER,CITE NASR D19 N 20B COMMUNE SAIDA,SAIDA,20,,
20-094,11129,pdv,PDV  FRIDI ABDELKADER,EX STATION BUS COMMUNE EL HASSASNA,EL HASSASNA,20,,
20-095,11130,pdv,PDV  RAMDANI NEBIA,CITE SAHRAOUI ABDELKADER N 29 30 COMMUNE YOUB SAIDA,YOUB,20,,
20-096,11131,pdv,PDV  DAHININE RACHID,CITE NASR LOCAL 02 COMMUNE SAIDA,SAIDA,20,,
20-097,11132,pdv,PDV  TOUMI BAHI,LOTISSEMENT 127 LOT BALLOUL N 83 COMMUNE OULED IBRAHIM SAIDA,OULED BRAHIM,20,,
20-098,11133,pdv,PDV  HOUBAD MOHAMED,KHERICHFA 71 LOT BALLOUL COMMUNE OULED IBRAHIM SAIDA,OULED BRAHIM,20,,
20-099,11134,pdv,PDV  ZAIRI ABDELKADER,PROJET 42 LOGEMENT SOCIAL PARTICIPATIF CITE SALEM 02 BT A N 01 COMMUNE SAIDA,SAIDA,20,,
20-100,11135,pdv,PDV  SLIMANI OKACHA,RUE FANTZ FANON N 29 LOCAL 02 COMMUNE SAIDA,SAIDA,20,,
20-101,11136,pdv,PDV  MAHSAR MLOUKA,RUE FIDAH TAYEB LOCAL 01 COMMUNE SIDI BOUBEKEUR SAIDA,SIDI BOUBEKEUR,20,,
20-102,11137,pdv,PDV  MERZOUGUI ABDELOUAHED,SIDI AISSA N 08 COMMUNE SIDI AMAR SAIDA,SIDI AMAR,20,,
20-103,11138,pdv,PDV  FARES BOUMEDIENE,ROUTE PRINCIPAL ENTREE SIDI AISSA COMMUNE SIDI AMAR,SIDI AMAR,20,,
20-104,11139,pdv,PDV  BEGHADID YAHIA,CITE 70 LOT COMMUNE HOUNET SAIDA,HOUNET,20,,
20-105,11140,pdv,PDV  BERRAOUI AHMED,CITE BITTAR ALI LOCAL 01 COMMUNE SIDI BOUBEKEUR,SIDI BOUBEKEUR,20,,
20-106,11141,pdv,PDV  ERROUANE MOHAMED FAROUK EL AMINE,RUE NASRI BEN OUIS LOCAL 02 COMMUNE YOUB,YOUB,20,,
20-107,11142,pdv,PDV  GOT SADIA EP MAATI,LOCAL 02 SITUE AVENUE DE LINDEPANDANCE COMMUNE SAIDA,SAIDA,20,,
20-108,11143,pdv,PDV  BOUCHIHA KAMEL,HOUNET CENTRE COMMUNE HOUNET,HOUNET,20,,
20-109,11144,pdv,PDV  AOUALI BOUHAFS,17 RUE AHMED BEN AMHAMED COMMUNE AIN EL HADJAR SAIDA,AIN EL HADJAR,20,,
20-110,11145,pdv,PDV  ABDELLAOUI BOUMEDYEN,COTE C N 11 COMMUNE TIRCINE SAIDA,TIRCINE,20,,
20-111,11146,pdv,PDV  KAID DJILLALI,CITE OGANE BOUAMAMA N 45 COMMUNE MOULAY EL ARBI SAIDA,MOULAY LARBI,20,,
20-112,11147,pdv,PDV  ALILI OUAHCHIA,KARIAT AIN TEGHAT COMMUNE OULED KHALED,OULED KHALED,20,,
20-113,11148,pdv,PDV  BERNI MALIKA,YOUB LOCAL 02 COMMUNE YOUB SAIDA,YOUB,20,,
20-114,11149,pdv,PDV  AMRANI YOUCEF,CITE VILLAGE BOUDIA N 03 ACTUELLEMENT MELLAH DJILLALI N 10 LOCAL 02 COMMUNE SAIDA,SAIDA,20,,
20-115,11150,pdv,PDV  IYED PHONE 02,LOCAL 02 LOT 033 LOT N 140 LOTISSEMENT CHAABANE N 101 REBAHIA COMMUNE OULED KHALED,OULED KHALED,20,,
20-116,11151,pdv,PDV  MESKINE NAIMA,LOTISSEMENT FIDJEL LOT 15 COMMUNE DAOUI THABET SAIDA,DOUI THABET,20,,
20-117,11152,pdv,PDV  AMER BADRA,OUM EJRANE LOCAL 02 N W COMMUNE EL HASSASNA SAIDA,EL HASSASNA,20,,
20-118,11153,pdv,PDV  NASRI MANSSOUR,TIRCINE COMMUNE TIRCINE SAIDA,TIRCINE,20,,
20-119,11154,pdv,PDV  BADRI HABIB,LOTISSEMENT SIDI CHEIKH N 02 COMMUNE SAIDA,SAIDA,20,,
20-120,11155,pdv,MOHAMEDI CHEIKH,CITE NASR PAVILLIO D1 5 N 68 LOCAL 02 COMMUNE SAIDA,SAIDA,20,,
20-121,11156,pdv,PDV  DJIDI MOHAMED AMINE,CITE SOUMMAM N 34 LOCAL 02 COMMUNE SAIDA,SAIDA,20,,
20-122,11157,pdv,PDV  ABBES MOHAMED,LOCAL 01 RUE DOCTEUR TIDJANI DAMARDJI COMMUNE SAIDA,SAIDA,20,,
20-123,11158,pdv,PDV  BOUDOUAYA MOHAMED,KIOSQUE COMMISSARIAT 02 COMMUNE SAIDA,SAIDA,20,,
20-124,11159,pdv,PDV  BOUALEM HAMID,RUE 1 NOVEMBRE LOCAL 02 COMMUNE AIN EL HADJAR SAIDA,AIN EL HADJAR,20,,
20-125,11160,pdv,PDV  BELHADJ KHEDIDJA,RUE KHEDARI DIAB N 11 COMMUNE OULED KHALED,OULED KHALED,20,,
20-126,11161,pdv,PDV  KHECHAB MOUARD,LOTISSEMENT FIDJEL N 86 COMMUNE DAOUI TABET SAIDA,DOUI THABET,20,,
20-127,11162,pdv,PDV  ABDELMALEK ABDELKRIM,RUE 1 NOVEMBRE LOT A LOCAL 02 COMMUNE AIN EL HADJAR SAIDA,AIN EL HADJAR,20,,
20-128,11163,pdv,PDV  KHALDI AMEUR,AIN SKHOUNA COMMUNE AIN SKHOUNA,AIN SKHOUNA,20,,
20-129,11164,pdv,PDV  ADDA BENDIDA,LOTISSEMETN 71 LOT KHERCHFA COMMUNE OULED IBRAHM SAIDA,OULED BRAHIM,20,,
20-130,11165,pdv,PDV  HAMADENE MOKHTAR,RUE MAKAME BEN KHADA N 03 COMMUNE HOUNET SAIDA,HOUNET,20,,
20-131,11166,pdv,PDV  HAFSI BEKHADA,LOTISSEMENT 150 LOGEMENT N 07 COMMUNE YOUB SAIDA,YOUB,20,,
20-132,11167,pdv,PDV  MOUKIL KHEIRA EP TAHRAOUI,N 07 MARCHE DE PROXIMITE SEMI COUVERT COMMUNE MAAMORA,MAAMORA,20,,
20-133,11168,pdv,PDV  GHOUTI HACHEMI,CITE NASR BATIMENT D1 08 RDC CN A SAIDA N 14 SAIDA,SAIDA,20,,
20-134,11593,pdv,PDV  BEN YAHIA HAMOU CHIKH,COMMUNE AIN SKHOUNA,AIN SKHOUNA,20,,
20-135,11594,pdv,PDV  MILOUDI REDA,LOCAL 01 RUE MOULOUD FERAOUNE N 06 COMMUNE SAIDA,SAIDA,20,,
20-136,12043,pdv,PDV  SAIDI YAMINA,40 LOGEMENT EVOLUTIF LOT 04 LOCAL 01 COMMUNE EL HASSASNA,EL HASSASNA,20,,
20-137,12088,pdv,PDV  ZIANI ABDELKRIM,RUE MAX MACHAND ET RUE MARTYRES LOCAL 05 COMMUNE SAIDA,SAIDA,20,,
20-138,12089,pdv,PDV  ANIME KHALED IBN EL WALID,RUE ADLI BACHIR LOCAL 02 COMMUNE YOUB,YOUB,20,,
20-139,12097,pdv,PDV  MAGRAOUI ZINEB,RUE FIDAH TAYEB N 09 LOCAL 03 COMMUNE SIDI BOUBEKEUR,SIDI BOUBEKEUR,20,,
21-001,46,pdv,GSM TRAD,31 RUE BACHIR BOUKADOUM N 04,SKIKDA,21,,
21-002,66,pdv,GSM TAALBI,COMMUNE AIN KECHERA,AIN KECHRA,21,,
21-003,116,pdv,GSM BOULEKNAFED,CITE 400 LOGEMENT COMMUNE COLLO,COLLO,21,,
21-004,200,pdv,GSM BOUBEHIRA,CITE OMAR BOULAKAIBAT LOCAL N 08,OUM TOUB,21,,
21-005,331,pdv,KOSMETIQUE ET TABAC BOUDJRIDA,CITE SIDI MEZGHICHE,SIDI MEZGHICHE,21,,
21-006,332,pdv,BS PHONE,34 ALI ABDENOUR,SKIKDA,21,,
21-007,490,pdv,KIOSQUE GUERSAL,RUE GUERMATA LOCAL 14,BENI OULBANE,21,,
21-008,491,pdv,G S M BOUBRYEM,CITE AHMED BOUBRYEM,OUM TOUB,21,,
21-009,545,pdv,GSM HAMIOUD,CITE 20 AOUT 55 PRES SONALGAZ,SKIKDA,21,,
21-010,552,pdv,GSM OULDJI,LARBI BEN MH IDI COMP GNL1 LOC 02,SKIKDA,21,,
21-011,761,pdv,GSM MOUHOUB,RUE EL KARIERE N 39 ZITOUNA,ZITOUNA,21,,
21-012,830,pdv,GSM JUSTE PRIX,41 RUE DIDOUCHE MOURAD,SKIKDA,21,,
21-013,845,pdv,GSM KEZZAR,RUE KOUICEM ABDELHAK COLLO,COLLO,21,,
21-014,861,pdv,GSM SADADOU,RUE LES FRERES KAFI LOCAL N 23,EL HARROUCH,21,,
21-015,921,pdv,LIBRAIRIE LALMI,CITE LARBI BEN MHIDI COMP SONATRACH ONB6 APART A1B LOCAL 02,SKIKDA,21,,
21-016,975,pdv,LIBRAIRIE BENDJEDDI,CITE 1000 LOGTS LOCAL 47,AZZABA,21,,
21-017,1090,pdv,PDV  GSM BARIOUT,CITE 460LOGTS BT 26 N 01,EL HARROUCH,21,,
21-018,3233,pdv,GSM LASOUI,RUE BOUHADRA FOUDIL LOCAL N 01,SALAH BOUCHAOUR,21,,
21-019,3234,pdv,GSM YOUNSI,RUE BAZIZ MOSTAPHA LOCAL N 33,EMDJEZ EDCHICH,21,,
21-020,3235,pdv,PDV GSM ARKOUB A,RUE LES FRERES KAFI LOCAL N 23A N 33,EL HARROUCH,21,,
21-021,3236,pdv,GSM MEHILA 2,CITE BACHIR BOUKADOUM,RAMDANE DJAMEL,21,,
21-022,3237,pdv,GSM MEHILA,LOTiSSEMENT BOULAFTOUR RABAH LOCAL N 02,RAMDANE DJAMEL,21,,
21-023,3238,pdv,PDV  GSM LAOUATI,CITE 16 LOGTS N03,RAMDANE DJAMEL,21,,
21-024,3239,pdv,PDV  GSM NECIB,CITE 16 100 LOGTS BT A N04,EL HARROUCH,21,,
21-025,3240,pdv,PDV  GSM BOUHAIM,CITE CNAS LOCAL 01,RAMDANE DJAMEL,21,,
21-026,3241,pdv,PDV  GSM MENICER,RUE ALI NAIM LOCAL 05,EMDJEZ EDCHICH,21,,
21-027,3242,pdv,PDV  GSM BOUCHEIKH,RUE BACHIR BOUKADOUM LOCAL 28S,EL HARROUCH,21,,
21-028,3243,pdv,PDV  GSM BOUGHABA,RUE BACHIR BOUKADOUM LOCAL 01,RAMDANE DJAMEL,21,,
21-029,3244,pdv,PDV  GSM ZOUAK,VILLAGE SAID BOUSBAA N01,EL HARROUCH,21,,
21-030,3245,pdv,PDV  GSM BAHI,CENTRE ECHANGE AGRICOL N 33,ZERDAZA,21,,
21-031,3246,pdv,PDV  GSM AHMED SID,RUE IBRAHIM BELMOKANI,ZERDAZA,21,,
21-032,3247,pdv,PDV  GSM BOUMEDIENE,CITE 40 LOGTS N 01,EL HARROUCH,21,,
21-033,3248,pdv,PDV  TABAI DJEFFEL KHALED,CITE LOTISEMENT N 02 SIDI MEZGHICHE,SIDI MEZGHICHE,21,,
21-034,3249,pdv,PDV  BOURARDA LYESS,RUE BOUANANE FRHATE N 02 SIDI MEZGHICHE,SIDI MEZGHICHE,21,,
21-035,3250,pdv,PDV  BENDIEB ABERKANE ANWAR,CITE LOTISEMENT N 02 SIDI MEZGHICHE,SIDI MEZGHICHE,21,,
21-036,3251,pdv,PDV  BOURARDA FETHI,RUE 20 AOUT 1955 N 02 SIDI MEZGHICHE,SIDI MEZGHICHE,21,,
21-037,3252,pdv,PDV  BOURARDA RIAD,RUE BOUANENE FRHET N28 SIDI MEZGHICHE,SIDI MEZGHICHE,21,,
21-038,3253,pdv,PDV  MEDERG NAROU DJAMEL,COMMUNE OULED HBABA N02,OULED HEBABA,21,,
21-039,3254,pdv,PDV  MEDERG NAROU ABDELHAIM,CITE 01 NOVEMBRE 1954,OULED HEBABA,21,,
21-040,3255,pdv,PDV  BENGHERSALLAH FAYSSAL,CITE 30 LOGTS BT 03 N 04,AIN BOUZIANE,21,,
21-041,3256,pdv,PDV  KARER KHEMISSA,CITE 80 LOGTS,SALAH BOUCHAOUR,21,,
21-042,3257,pdv,PDV GSM BOUFDAH BADISSI MOHAMED LAMINE,RUE OULHA AHMED,BENI OULBANE,21,,
21-043,3258,pdv,PDV  GSM,RUE OULHA AHMEDN 02,BENI OULBANE,21,,
21-044,3259,pdv,PDV  FEKRACHE FARES,COMMUNE OUM TOUB CENTRE,OUM TOUB,21,,
21-045,3260,pdv,PDV GSM BOUGUERRA ABDELZIZ,CITE AMED BOUBRYEM N 01,OUM TOUB,21,,
21-046,3261,pdv,PDV  BOULOUDNINE HACENE,COMMUNE OUM TOUB CENTRE,OUM TOUB,21,,
21-047,3262,pdv,PDV GSM MEDJNOUNE RIAD,CITE AHMED BOUBRYEM N 74,OUM TOUB,21,,
21-048,3263,pdv,PDV GSM BERRAHAL RIAD,CITE 40 LOGTS BACHIR BOUKADOUM,EL HARROUCH,21,,
21-049,3264,pdv,PDV GSM TOUMI AZZEDINE A3.,CITE BACHIR BOUKADOUM,EL HARROUCH,21,,
21-050,3265,pdv,PDV GSM TOUMI AZZEDINE A4.,CITE BACHIR BOUKADOUM,EL HARROUCH,21,,
21-051,3266,pdv,PDV GSM BOUDCHICHA HICHEM,CITE 100 LOGTS,EL HARROUCH,21,,
21-052,3267,pdv,PDV GSM BOULOUDNINE ABDELKRIM,CITE 48 LOGTS BT N01 N 08,OUM TOUB,21,,
21-053,3268,pdv,PDV GSM MATALLAH,RUE HOUARI BOUMEDIENE CITE 641 LOGTS BT 35 LOCAL N 61B,SKIKDA,21,,
21-054,3269,pdv,PDV GSM SELDJA,GROUPE 08 LOCAUX HAMROUCHE HAMOUDI LOCAL N 07,HAMADI KROUMA,21,,
21-055,3270,pdv,GSM BOUAFFAR,CITE MOHAMED BOUKERKOUR ENADJAH BT A N 05B,SKIKDA,21,,
21-056,3271,pdv,GSM TAZIR,CITE LACIA BT LAVIGI PARTE 125,SKIKDA,21,,
21-057,3272,pdv,GSM BAGHRICHE,RUE BACHIR BOUKADOUM N 92,SKIKDA,21,,
21-058,3273,pdv,PDV  GSM MAOUI SALIH,CENTRE COMMERCIAL RUE DES ALLEES 20 AOUT 55 LOCAL 87B,SKIKDA,21,,
21-059,3274,pdv,PDV  GSM BENABDELAZIZ,CITE DES ALLEES DU 20 AOUT 55 LOCAL 3A,SKIKDA,21,,
21-060,3275,pdv,PDV  GSM HADDAD,CITE DES ALLEES DU 20 AOUT 55 LOCAL 01,SKIKDA,21,,
21-061,3276,pdv,PDV  GSM ABDELLI,CITE DU 20 AOUT 55 LOCAL 02,SKIKDA,21,,
21-062,3277,pdv,PDV  GSM ALIOUCHE,CITE 119 LOGTS SALAH BOULKAROUA BT 14,SKIKDA,21,,
21-063,3278,pdv,PDV  GSM GRES,CENTRE COMMERCIAL MERDJ EDIB BT 121 PART 05,SKIKDA,21,,
21-064,3279,pdv,PDV  GSM NAMOUS,CITE FRERES AYACHI BT 173 N14,FILFILA,21,,
21-065,3280,pdv,PDV  GSM BOUHALOUS MOHAMED,CITE FRERES LAKHAL VLLA 242 LOCAL 04,FILFILA,21,,
21-066,3281,pdv,PDV  GSM BOUHALOUS SALAH,CITE FRERES AYACHI BT 03,FILFILA,21,,
21-067,3282,pdv,PDV  GSM CHENNOUF,PROJET 90 LOGTS CITE LAVIGI BT A LOCAL 07,SKIKDA,21,,
21-068,3283,pdv,PDV  GSM KHALFI,RUE DIDOUCHE MOURAD PARTE 01 LOCAL N 02,SKIKDA,21,,
21-069,3284,pdv,PDV  GSM KERBOUA,LOTUSSEMENT SALAH BOULKAROUA VILLA 19 LOCAL N 02,SKIKDA,21,,
21-070,3285,pdv,PDV  GSM BOUFERCHA,RUE DIDOUCHE MOURAD BT 09 PARTE N 01,SKIKDA,21,,
21-071,3286,pdv,PDV  GSM RAGHEB,CITE BOUKARKOUR MOHAMED COOPERATIVE IMMOBILIERE ENNADJAH BT A PARTE N 02,SKIKDA,21,,
21-072,3287,pdv,PDV  GSM HAMIOUD,CITE DES ALLEES 20 AOUT 1955 TOUR 03 LOCAL N 03,SKIKDA,21,,
21-073,3288,pdv,PDV  GSM KAOUANE,AVENU HOCINE LOZAT LOCAL 07B N02,SKIKDA,21,,
21-074,3289,pdv,PDV  GSM HAMIED FATEH2,RUE DIDOUCHE MOURAD BT 44,SKIKDA,21,,
21-075,3290,pdv,PDV  GSM HAMIED FATEH,RUE DIDOUCHE MOURAD BT 29 B,SKIKDA,21,,
21-076,3291,pdv,PDV  GSM BOULMIAL,AVENU DIDOUCHE MOURAD N42,SKIKDA,21,,
21-077,3292,pdv,PDV  GSM IRIZA,49 AVENU DIDOUCHE MOURAD,SKIKDA,21,,
21-078,3293,pdv,PDV  GSM LAHOUES,RUE ABDELLAH BEN GHERSELLAH N02,SKIKDA,21,,
21-079,3294,pdv,PDV  GSM ADJIRIOU,AVENU DIDOUCHE MOURAD PART 03 N55,SKIKDA,21,,
21-080,3295,pdv,PDV  GSM CHAIB,RUE CHABANE RAMOUCHE BT 04 LOCAL 21,SKIKDA,21,,
21-081,3296,pdv,PDV  GSM AIDOUNI,AVENU DIDOUCHE MOURAD N 89,SKIKDA,21,,
21-082,3297,pdv,PDV  GSM MEDEREG NAROU,LOCAL 01,OULED HEBABA,21,,
21-083,3298,pdv,PDV  GSM BOUAKAZ,CENTRE COMMERCIAL MERDJ EDIB VILLA 326 LOCAL 02,SKIKDA,21,,
21-084,3299,pdv,PDV  GSM DJOUAMA,CITE 20 AOUT 55 BT A ENTREE OA PART 19,SKIKDA,21,,
21-085,3300,pdv,PDV  GSM MOUSSAOUI,CTE ZEGHDOUD MADJID N05 LOCAL 5S,EL HADAIK,21,,
21-086,3301,pdv,PDV  GSM BOUZEBRA,CITE ZEGHDOUD MADJID BT 21 LOCAL 01,EL HADAIK,21,,
21-087,3302,pdv,PDV  LIBRAIRIE KHELIFI,BOUMAIZA COMMUNE BEN AZZOUZ,BEN AZZOUZ,21,,
21-088,3303,pdv,PDV  GSM LATRECHE,LOTUSSEMENT 01 PART 07 LOCAL 02,BOUCHTATA,21,,
21-089,3304,pdv,PDV  GSM GUEDMANI,64 AVENU YOUCEF KADID,SKIKDA,21,,
21-090,3305,pdv,PDV  GSM BOULEGLEM,CITE BOUYALA PROJET 200 LOGTS BT 1 N 04,SKIKDA,21,,
21-091,3306,pdv,PDV  GSM HADEF,CITE HAMADI KROUMA CENTRE LOCAL 29A,HAMADI KROUMA,21,,
21-092,3307,pdv,PDV  GSM BENHAMROUCHE,ROUTE MOHAMED BOUGUARGOUR ELNADJAH BT B6,SKIKDA,21,,
21-093,3308,pdv,PDV  GSM LITIM,MECHTA LAGHOUAT LARBI BEN MHIDI LOCAL 01,SKIKDA,21,,
21-094,3309,pdv,PDV  GSM DAAS,LOTUSSEMENT EL KHAROUBA N 34,HAMADI KROUMA,21,,
21-095,3310,pdv,PDV  GSM LOUKIL,RUE KADOUR BELIZIDIA N64,SKIKDA,21,,
21-096,3311,pdv,PDV  GSM BENDIR,RUE 01 NOVEMBRE 1954 PARTE N 12,AZZABA,21,,
21-097,3312,pdv,PDV  GSM MAOUI 2,CITE 20 AOUT 55 BT A ENTREE AS PART 09,SKIKDA,21,,
21-098,3313,pdv,PDV  GSM BOUCHAMA,RUE NAMOUCHI AMAR LOCAL N 02,AIN CHERCHAR,21,,
21-099,3314,pdv,PDV  GSM BOULESNANE,CITE 19 MARS,BENI BECHIR,21,,
21-100,3315,pdv,PDV  GSM MESSAHEL,ZAOUIA CENTRE LOCAL N 01,AZZABA,21,,
21-101,3316,pdv,PDV  GSM YAKOUBI,RUE 01 NOVEMBRE 1954 LOCAL N 06 S,AZZABA,21,,
21-102,3317,pdv,PDV  GSM AOUADI,RUE LADAISSIA KHAMIS LOCAL N 4,ES SEBT,21,,
21-103,3318,pdv,PDV  GSM AOUADI 2,RUE 01 NOVEMBRE 1954 LOCAL N 01,AZZABA,21,,
21-104,3319,pdv,PDV  GSM BENZEGHA,RUE MOHAMED BOUDIAF,AZZABA,21,,
21-105,3320,pdv,PDV  GSM ZIAITA,CITE KHOUDJA MEZGHACHE LOTUSSEMENT N 01 LOCAL N 02,AZZABA,21,,
21-106,3321,pdv,PDV  GSM BOULEZAZ,RUE AMIR ABDELKADER LOCAL N 01,AZZABA,21,,
21-107,3322,pdv,PDV  GSM BAKHOUCHE,RUE 20 AOUT 1955 LOCAL N 55A,AZZABA,21,,
21-108,3323,pdv,PDV  GSM MANAA,CITE 1000 LOGTS LOCAL N 47,AZZABA,21,,
21-109,3324,pdv,PDV  GSM FISLI,RUE REVOLUTION,AZZABA,21,,
21-110,3325,pdv,PDV  LIBRAIRIE MECHERI,CITE 19 MARS VILLAGE AGRICOLE LOCAL N 01,BENI BECHIR,21,,
21-111,3326,pdv,PDV  LIBRAIRIE BOUOUDEN,COMMUNE BEKKOUCHE LAKHDAR,BEKKOUCHE LAKHDAR,21,,
21-112,3327,pdv,PDV  LIBRAIRIE MOKHNECHE,SIDI SAID LOCAL N 02,BEKKOUCHE LAKHDAR,21,,
21-113,3328,pdv,PDV  GSM BEI,CITE 40 LOGTS BT 4 LOCAL N 02,AIN CHERCHAR,21,,
21-114,3329,pdv,PDV  GSM DJILANI,03 RUE MELILA LOTUSSEMENT 09 PARTES PARTE N 4,AZZABA,21,,
21-115,3330,pdv,PDV  GSM CHAOUCH,BEN AZZOUZ CENTRE LOCAL N 03,BEN AZZOUZ,21,,
21-116,3331,pdv,PDV  GSM BOUHAINE,KHANTOUL SAID LOCAL N 12 S,DJENDEL SAADI MOHAMED,21,,
21-117,3332,pdv,PDV GSM REZAGUI.,MOSQUEE EL ATIK,AZZABA,21,,
21-118,3333,pdv,GSM SAIDI,LOTUSSEMENT TOURISTIQUE 03 PARTE 08 J,EL MARSA,21,,
21-119,3334,pdv,LIBRAIRIE BOUMEDIENE,MANZIL EL ABTAL LOCAL N 01,AZZABA,21,,
21-120,3335,pdv,PDV  LIBRAIRIE HALIMI,VILLAGE BOUMAIZA CITE 34 LOGTS BT 15B LOCAL N 02,BEN AZZOUZ,21,,
21-121,3336,pdv,PDV  LIBRAIRIE LADACI,CITE 1000 LOGTS BT 48 LOCAL N 04,AZZABA,21,,
21-122,3337,pdv,PDV  LIBRAIRIE ZAKAD,LOCAL N 01,BEN AZZOUZ,21,,
21-123,3338,pdv,PDV  GSM DAIF,RUE GUERFI MAHMOUD LOCAL N 04,AIN CHERCHAR,21,,
21-124,3339,pdv,PDV  GSM KRIKA,COMMUNE AIN KECHERA,AIN KECHRA,21,,
21-125,3340,pdv,PDV  GSM MOKHTARI,COMMUNE AIN KECHERA,AIN KECHRA,21,,
21-126,3341,pdv,PDV  GSM MOKHTARI A1.,COMMUNE AIN KECHERA,AIN KECHRA,21,,
21-127,3342,pdv,PDV  GSM MECIBAH,RUE ALI BAIKER LOULOUDJ COMMUNE BENI ZID,BENI ZID,21,,
21-128,3343,pdv,PDV  GSM LEKHCHINE,CITE MOHAMED ACHOUR COMMUNE KERKERA,KERKERA,21,,
21-129,3344,pdv,PDV  GSM BOUTARENE,CENTRE BEIN ELOUIDEN,BIN EL OUIDEN,21,,
21-130,3345,pdv,GSM ROUAG,COMMUNE BEIN ELOUIDEN,BIN EL OUIDEN,21,,
21-131,3346,pdv,PDV  GSM BOUOUEDEN,CENTRE BEIN ELOUIDEN,BIN EL OUIDEN,21,,
21-132,3347,pdv,GSM CHALABI,COMMUNE BEIN ELOUIDEN,BIN EL OUIDEN,21,,
21-133,3348,pdv,PDV  GSM BOUMESRANE,ELTAHOUNA COMMUNE BEIN ELOUIDEN,BIN EL OUIDEN,21,,
21-134,3349,pdv,GSM BOUHAFER,COMMUNE CHERAIA,CHERAIA,21,,
21-135,3350,pdv,PDV GSM DOKKARI.,AVENNUE AYACHE RAVAH COLLO,COLLO,21,,
21-136,3351,pdv,PDV  GSM RAMOUL,AIN AGHBAL COMMUNE CHERAIA,COLLO,21,,
21-137,3352,pdv,GSM BENDJEMA,AVENNUE YASSAD RABAH COLLO,COLLO,21,,
21-138,3353,pdv,PDV GSM LEZRAK A,AVENNUE PALESTINE COMMUNE COLLO,COLLO,21,,
21-139,3354,pdv,GSM BECHIKHI,CITE HAMIDI CHETTI COLLO,COLLO,21,,
21-140,3355,pdv,GSM LEZRAK,AVENNUE KHENAT SADEK COLLO,COLLO,21,,
21-141,3356,pdv,GSM HAMOUDA,AVENNUE ROUIBAH ABDELHAMID COLLO,COLLO,21,,
21-142,3357,pdv,PDV  GSM KOLLI,AVENNUE AYACHE RABAH COLLO,COLLO,21,,
21-143,3358,pdv,PDV GSM LEZRAK,AVENNUE LEKHAL TAHAR COLLO,COLLO,21,,
21-144,3359,pdv,GSM MENACER,CITE CHALABI BOUSTIL COLLO,COLLO,21,,
21-145,3360,pdv,PDV  GSM KEFSI,AVENUE 20 AOUT 1955 COLLO,COLLO,21,,
21-146,3361,pdv,PDV  GSM RAHIMI,CENTRE KANOUA,KANOUA,21,,
21-147,3362,pdv,PDV  GSM ZAIKH,RUE ZIGHOUD YOUCEF KERKERA,KERKERA,21,,
21-148,3363,pdv,PDV  GSM BOUDROUMA,COMMUNE KERKERA,KERKERA,21,,
21-149,3364,pdv,GSM BOUROUROU,RU 20 AOUT 1955 COMMUNE KERKERA,KERKERA,21,,
21-150,3365,pdv,PDV  GSM CHAOUACHE,KRIA BOUNOGHRA COMMUNE OULED ATTIA,OULED ATTIA,21,,
21-151,3366,pdv,PDV  GSM BOULIF,KRIA LAKHEMIS COMMUNE OUED ZEHOUR,OULED ATTIA,21,,
21-152,3367,pdv,PDV  GSM GHARBI,RUE 20 AOUT 1955 COMMUNE TAMALOUS,TAMALOUS,21,,
