id,name,wilaya_code,commune_code,commune,lat,lng,geo_precision,geo_method,source,operator,address,sources
noest-45a,Noest Naâma «Mécheria»,45,,Mécheria,33.5444205,-0.2728641,exact,carrier_relay,noest,noest,"Route Nationale n°06, à côté de l’hôtel Amine et du centre d’Algérie Télécom","[""noest""]"
noest-46a,Noest Aïn Témouchent,46,,Aïn Témouchent,35.3032295,-1.1457067,exact,carrier_relay,noest,noest,22A cité des oliviers ain témouchnet 46000(en face du parking de la wilaya),"[""noest""]"
noest-47a,Noest Ghardaïa,47,,Ghardaïa,32.4907065,3.6813486,exact,carrier_relay,noest,noest,"Rue principale Hadj Messaoud en face la branche municipale, Haj Masoud","[""noest""]"
noest-48a,Noest Relizane,48,,Relizane,35.7299338,0.5451895,exact,carrier_relay,noest,noest,"Cité 31 logmt en face la justice, a coté de la banque societé général algerie","[""noest""]"
noest-49a,Noest Timimoun,49,,Timimoun,29.2585961,0.2389837,exact,carrier_relay,noest,noest,"cité MAHDJOUB N° de la porte 16 , Timimoun en face le stade et SAA","[""noest""]"
noest-52a,Noest Beni Abbes,52,,Beni Abbes,30.1322451,-2.1654109,exact,carrier_relay,noest,noest,"A coté la wilaya BENI ABBES , en face LAPIWI ( المجلس الشعبي الولائي (","[""noest""]"
noest-53a,Noest In Salah,53,,In Salah,27.2009682,2.4814744,exact,carrier_relay,noest,noest,"Près de la Direction des travaux publics, en face de l'entrée du radar d'Algérie Télécom","[""noest""]"
noest-56a,Noest Djanet,56,,Djanet,24.5574068,9.4839447,exact,carrier_relay,noest,noest,"Centre-ville Tine Khatema, à côté du dentiste, Djanet","[""noest""]"
noest-58a,Noest El Meniaa,58,,El Meniaa,30.577354,2.881551,exact,carrier_relay,noest,noest,Rue de l'unite African (À côté de la boulangerie Boussaid) Il se trouve à 20 mètres de la mosquée saad beno abi elouas,"[""noest""]"
