id,name,wilaya_code,commune_code,commune,lat,lng,geo_precision,geo_method,source,operator,address,sources
100101,Agence Ain Bessem,10,,Aïn Bessem,36.29384322085325,3.6756484464787,exact,carrier_relay,yalidine,guepex,"Rue Abdelkader Bouziane, Section 46 Groupe de propriété n°156 Commune d’Aïn Bessem","[""yalidine""]"
10101,Agence de Adrar,01,,Adrar,27.875695678434518,-0.28488572885492014,exact,carrier_relay,guepex,yalidine,"Rue Benhachem Maamar, Adrar","[""guepex"",""yalidine""]"
10102,Agence El Hataba (Adrar),01,,Adrar,27.877111483781547,-0.29309172883587653,exact,carrier_relay,yalidine,easyandspeed,"Rue Allal, Section 22, Groupe de propriété 262, porte n°01, Commune et Wilaya d’Adrar","[""yalidine""]"
101601,Agence de Bouira,10,,Bouira,36.37042045017322,3.8758492313266446,exact,carrier_relay,guepex,yalidine,Lotissement Amar Khoudja B0 (A Gauche Du Nouveau Rond Point D'Aigle En Allant Vers Le Boulevard),"[""guepex"",""yalidine""]"
103101,Agence de Lakhdaria,10,,Lakhdaria,36.563972759374806,3.5993137308374,exact,carrier_relay,guepex,yalidine,"cité si Lakhdar Derrière l'Algérienne des Eaux, À côté du laboratoire Boudina.","[""guepex"",""yalidine""]"
10401,Agence Reggane,01,,Reggane,26.722592393828023,0.16756553837153132,exact,carrier_relay,yalidine,yalidine,شارع الأمير عبد القادر حي 20 مسكن للتوفير و الاحتياط,"[""yalidine""]"
104101,Agence de Sour El Ghouzlane,10,,Sour El Ghouzlane,36.143071573354455,3.6951283180568684,exact,carrier_relay,guepex,guepex,"N°03 Cite Sayeh, Section 13","[""guepex"",""yalidine""]"
110101,Agence de Tamanrasset (Gataâ El Oued),11,,Tamanrasset,22.78495481213817,5.517133685352839,exact,carrier_relay,guepex,guepex,Cité Gataâ El Oued N 742 743 Commune Tamanrasset,"[""guepex"",""yalidine""]"
110102,Agence Tamanrasset (Tahaggart),11,,Tamanrasset,22.791772342647075,5.519063835582057,exact,carrier_relay,guepex,yalidine,Tahaggart CHARKIA EN FACE MOSQUEE F.ZAHRAA,"[""guepex"",""yalidine""]"
110103,Agence Tamanrasset (Sorro Ivolutif),11,,Tamanrasset,22.80004375984567,5.545667632367685,exact,carrier_relay,guepex,easyandspeed,حي سورو (تجزئة 505 قطعة) بلدية تامنراست,"[""guepex""]"
11201,Agence Aoulef,01,,Aoulef,26.97104710045972,1.0833315383800848,exact,carrier_relay,yalidine,easyandspeed,"Cité Amanat, Section 035, Groupe de propriété 026, porte N°23,Commune Aoulef, Wilaya d’Adrar","[""yalidine""]"
120101,Agence de Tébessa,12,,Tébessa,35.396636906679085,8.109079713415683,exact,carrier_relay,guepex,yalidine,Boulevard Houari Boumediene (En Face De La Pharmacie Hazourli),"[""guepex"",""yalidine""]"
120103,Centre de tri Skanska (Tébessa),12,,Tébessa,35.40498213138372,8.100629186509849,exact,carrier_relay,guepex,yalidine,"Cité El Amel, Skanska, Tébessa","[""guepex"",""yalidine""]"
120301,Agence Cheria (Tébessa),12,,Cheria,35.27905616702475,7.757957548028531,exact,carrier_relay,guepex,guepex,رقم 10مكرر التحصيص البلدي رقم 02,"[""guepex"",""yalidine""]"
130101,Agence de Tlemcen (Bel-Air),13,,Tlemcen,34.87551290379688,-1.3211592999999997,exact,carrier_relay,guepex,guepex,"Quartier Mohammed 05, Bel-Air, Tlemcen","[""guepex"",""yalidine""]"
130103,Agence de Tlemcen (Mansourah),13,,Tlemcen,34.88115577405357,-1.332723451208682,exact,carrier_relay,guepex,yalidine,"Boulevard Imama (En face la piscine Olympique), Mansourah, Tlemcen","[""guepex"",""yalidine""]"
130104,Agence Tlemcen Amandiers,13,,Tlemcen,34.88819960107972,-1.3274392711641239,exact,carrier_relay,yalidine,easyandspeed,"Cité El-Kiffane, Local 02, Section 116 llot.p33, Tlemcen","[""yalidine""]"
130401,Agence Remchi,13,,Remchi,35.064552027377694,-1.4317729336527052,exact,carrier_relay,guepex,yalidine,"Rue Takia Ben Abdallah, GP 111, Section 62, en face de la Banque CPA Remchi et à côté de l'imprimerie Bensalah","[""guepex"",""yalidine""]"
132701,Agence de Maghnia,13,,Maghnia,34.844893260256576,-1.721598911713723,exact,carrier_relay,guepex,yalidine,"Tafna N°4 Cite Perri, Maghnia, Tlemcen","[""guepex"",""yalidine""]"
135001,Agence Chetouane,13,,Chetouane,34.90893882311112,-1.2930467499547136,exact,carrier_relay,guepex,yalidine,"Zone industrielle, Chetouane, Tlemcen","[""guepex"",""yalidine""]"
143901,Agence de Tiaret,14,,Tiaret,35.36817378579679,1.3328889101032386,exact,carrier_relay,guepex,yalidine,"Rue police Amer, n 161","[""guepex"",""yalidine""]"
150101,Agence de Bekkar,15,,Tizi Ouzou,36.70517616666733,4.058703310312472,exact,carrier_relay,guepex,guepex,"Cite Bekkar Classe: 78 Propriété Groupe 137 (En Face la Placette), Bekkar, Tizi Ouzou","[""guepex"",""yalidine""]"
150102,Agence de Nouvelle Ville,15,,Tizi Ouzou,36.69298682328048,4.051372364416736,exact,carrier_relay,guepex,yalidine,"Nouvelle Ville, Tizi Ouzou","[""guepex"",""yalidine""]"
151101,Agence de Tizi Gheniff,15,,Tizi Gheniff,36.59031892958808,3.7745891447025954,exact,carrier_relay,guepex,guepex,"Rue Fatoum Amar, Rez-de-Chaussee Bt:17, N° 02, Tizi Gheniff, Tizi Ouzou","[""guepex"",""yalidine""]"
151801,Agence de Azazga,15,,Azazga,36.74390989580551,4.367373988328014,exact,carrier_relay,guepex,yalidine,"01 Rue Djurdjura, Immeuble Ait Amara (Dépôt), Azazga, Tizi Ouzou","[""guepex"",""yalidine""]"
153201,Agence Beni Douala,15,,Beni Douala,36.61951273368813,4.070628242328079,exact,carrier_relay,yalidine,yalidine,"Beni Douala, Tizi Ouzou","[""yalidine""]"
154701,Agence de Draâ Ben Khedda,15,,Draâ Ben Khedda,36.728128393643594,3.9659861144322925,exact,carrier_relay,guepex,guepex,"Touares 01, Draâ Ben Khedda, Tizi Ouzou","[""guepex"",""yalidine""]"
160101,Agence Sacré-Cœur,16,,Alger Centre,36.7635831801555,3.0471151913967005,exact,carrier_relay,guepex,guepex,"116 Didouche Mourad, Sacré Cœur, Alger","[""guepex"",""yalidine""]"
160501,Agence de Bab El Oued,16,,Bab El Oued,36.788921063414854,3.0485394932807495,exact,carrier_relay,guepex,guepex,"107 Rue Colonel Lotfi, Bab El Oued, Alger","[""guepex"",""yalidine""]"
160902,Agence Bir Mourad Rais,16,,Bir Mourad Raïs,36.738515044397246,3.0539694576708545,exact,carrier_relay,guepex,easyandspeed,"14 Rue des Trois, Rue des Frères Bouadou, Bir Mourad Raïs, Alger","[""guepex"",""yalidine""]"
161201,Agence de Birkhadem,16,,Birkhadem,36.728714872725824,3.0553242452285136,exact,carrier_relay,guepex,yalidine,"Cité Les Vergers Villa N°1, Birkhadem, Alger","[""guepex"",""yalidine""]"
161401,Agence de Baraki,16,,Baraki,36.665013766367615,3.091836877210686,exact,carrier_relay,guepex,guepex,"Route de Larbâa (à Coté de la Supérette Promo+), Baraki, Alger","[""guepex"",""yalidine""]"
161503,Agence El Harrach (Beaulieu),16,,Oued Smar,36.71179225866924,3.1575205669471558,exact,carrier_relay,guepex,wecanservices,"128 Rue Boubaghla Lot: 08 GPE MTE N°229 Lot N°02 RDC, Beaulieu, Oued Smar, Alger","[""guepex"",""yalidine""]"
161601,Agence de Bachdjerrah,16,,Bachdjerrah,36.71901560003096,3.109847971163656,exact,carrier_relay,guepex,wecanservices,"Bachdjerrah 3 Derrière l’ancien APC, à Environ 80m du Métro, Bachdjerrah, Alger","[""guepex"",""yalidine""]"
161701,Agence de Hussein Dey,16,,Hussein Dey,36.73593184624371,3.117008726064961,exact,carrier_relay,guepex,yalidine,"Route Tripoli N°152, El Magharia, Alger","[""guepex"",""yalidine""]"
161801,Agence Kouba,16,,Kouba,36.72543355719765,3.0908529119026102,exact,carrier_relay,yalidine,yalidine,"Lotissement 26 Tranche 56 Local:01, Ben Omar, Kouba, Alger","[""yalidine""]"
162003,Agence d'El Hamiz,16,,Dar El Beïda,36.724635189426365,3.2386747288555875,exact,carrier_relay,guepex,easyandspeed,"Cité les Orangers Groupe (A) Villa N°431, El Hamiz (En face le Stade), El Hamiz, Alger","[""guepex"",""yalidine""]"
162102,Agence Bab Ezzouar,16,,Bab Ezzouar,36.720456069053455,3.1842058696201057,exact,carrier_relay,yalidine,yalidine,"EPLF - Bab Ezzouar, Alger","[""yalidine""]"
163001,Agence de Bordj El Kiffan,16,,Bordj El Kiffan,36.74863150288901,3.20052947265849,exact,carrier_relay,guepex,yalidine,"Rue 1er Novembre 26 Cité Mimouni N:04, Bordj El Kiffan, Alger","[""guepex"",""yalidine""]"
163302,Agence Les Eucalyptus,16,,Les Eucalyptus,36.66711648843321,3.1427310694191215,exact,carrier_relay,guepex,zimou-express,"Rue Les Eucalyptus, N°56, Palais Rouge, Les Eucalyptus, Alger","[""guepex"",""yalidine""]"
163401,Agence de Birtouta,16,,Birtouta,36.645369231973724,3.0043017206575358,exact,carrier_relay,guepex,guepex,"06 Rue El Moudjahid Hamida Mouhamed (à Côté de Super Marquet Saadi), Birtouta, Alger","[""guepex"",""yalidine""]"
163901,Agence Bordj El Bahri (Café Chergui),16,,Bordj El Bahri,36.780248835053634,3.249505410050749,exact,carrier_relay,guepex,yalidine,"Groupe de Propriété N°3065, Section 02, Rez-de-chaussée, Commune de Bordj El Bahri, Wilaya d'Alger","[""guepex"",""yalidine""]"
164201,Agence de Rouïba,16,,Rouïba,36.73755329601874,3.280255195985044,exact,carrier_relay,guepex,zimou-express,"Rue Hassiba Ben Bouali (Chemin Polyclinique), Rouïba, Alger","[""guepex"",""yalidine""]"
164301,Agence de DNC (Reghaïa),16,,Reghaïa,36.74734575091702,3.3423594000001984,exact,carrier_relay,guepex,yalidine,"Cité El Ouancharis, DNC, Route de Ain Taya (En face Société Générale), Reghaïa, Alger","[""guepex"",""yalidine""]"
164401,Agence de Aïn Benian,16,,Aïn Benian,36.80041848415821,2.9025755690190453,exact,carrier_relay,guepex,guepex,"19 Route Al-Jamilah, Division Kargon, Aïn Benian, Alger","[""guepex"",""yalidine""]"
164601,Agence de Zeralda,16,,Zeralda,36.71270234813457,2.8343161757238713,exact,carrier_relay,guepex,guepex,"Local Commercial RDC, Cité Yesswel Kouider N°01, Zeralda, Alger","[""guepex"",""yalidine""]"
164701,Agence de Sidi Abdellah,16,,Mahelma,36.689675206551044,2.8608359999999995,exact,carrier_relay,guepex,zimou-express,"Cité 1400 local C6 Bt C6 Sidi Abdallah, Alger","[""guepex"",""yalidine""]"
165001,Agence Dar Diaf,16,,Cheraga,36.76825125970716,2.964346070388397,exact,carrier_relay,guepex,yalidine,"Dar Diaf (à Côté De La Supérette Sedda), Cheraga, Alger","[""guepex"",""yalidine""]"
165002,HUB Cheraga (Plateau),16,,Cheraga,36.77458263742349,2.954507842328247,exact,carrier_relay,guepex,yalidine,"10, Rue Aïn Benian Partie: 192 C2, Cheraga, Alger","[""guepex"",""yalidine""]"
165101,Agence de Ouled Fayet,16,,Ouled Fayet,36.731778405827896,2.9569217546192674,exact,carrier_relay,guepex,guepex,"19 Route du Stade Communal, Ouled Fayet, Alger","[""guepex"",""yalidine""]"
165301,Agence de Draria,16,,Draria,36.72112076655928,2.9899307253169414,exact,carrier_relay,guepex,guepex,"Cité Darbush 145, Habitation 400, Bâtiment 2, Draria, Alger","[""guepex"",""yalidine""]"
170501,Agence de Aïn Oussara,65,,Aïn Oussara,35.44999644877334,2.9044317099914543,exact,carrier_relay,guepex,yalidine,"Cité Mohamed Boudiaf (Rue en face la BNA, à coté de douche Rebhi), Ain Oussara, Djelfa","[""guepex"",""yalidine""]"
171401,Agence de Djelfa,17,,Djelfa,34.6810443367391,3.277842246383707,exact,carrier_relay,guepex,yalidine,"Cité Boutrifis, Route de Boussaâda, Lotissement 137 N 06 Immeuble Djouaf Ameur, Djelfa","[""guepex"",""yalidine""]"
180101,Agence de Jijel,18,,Jijel,36.82170292619886,5.758994169977939,exact,carrier_relay,guepex,yalidine,Village Mustapha RDC ROUTE SOUMMAM N°24,"[""guepex"",""yalidine""]"
180102,Agence de Jijel Bourmel,18,,Jijel,36.81386408918035,5.742336097583295,exact,carrier_relay,yalidine,easyandspeed,Lotissement Bourmel Jijel,"[""yalidine""]"
180501,Agence de Taher,18,,Taher,36.77014887982159,5.8945063102513835,exact,carrier_relay,guepex,guepex,"Immeuble Des Bailleurs, Section 58, Groupement De Propriete N°111, Quartier Zemouch","[""guepex"",""yalidine""]"
180901,Agence de El Milia,18,,El Milia,36.74812705604037,6.27440627114814,exact,carrier_relay,guepex,guepex,Rue Boulakirba Zidane,"[""guepex"",""yalidine""]"
181401,Agence Kaous (Jijel),18,,Kaous,36.77631535560025,5.8116844576712765,exact,carrier_relay,guepex,yalidine,"Cité Amoura Messouad N°02 Commune Kaous,Jijel","[""guepex"",""yalidine""]"
190202,Agence Aïn Arnat,19,,Aïn Arnat,36.19147228980431,5.329148996421013,exact,carrier_relay,yalidine,easyandspeed,"Quartier 400 logements, commune d’Aïn Arnat, site n°01, acte n°12, immeuble n°10, daïra d’Aïn Arnat, wilaya de Sétif","[""yalidine""]"
190701,Agence de Aïn Oulmene,19,,Aïn Oulmene,35.92853421113711,5.29630369691054,exact,carrier_relay,guepex,guepex,"Subdivision 264, lot — zone urbaine, Aïn Oulmène.","[""guepex"",""yalidine""]"
192601,Agence de Bougaa,19,,Bougaa,36.33332614477243,5.0910191674128775,exact,carrier_relay,guepex,guepex,"Rue Mohamed Chinoune, Bougaa, Sétif","[""guepex"",""yalidine""]"
193202,Desk El Eulma,19,,El Eulma,36.15225059777369,5.695548728857927,exact,carrier_relay,guepex,yalidine,"Rue Abdelaziz Khaled, N°119 (à Côté du Hôtel El Bez), Eulma, Sétif","[""guepex"",""yalidine""]"
193203,Agence El Eulma (Cité Sonatrach Smara S),19,,El Eulma,36.15150000000002,5.667,exact,carrier_relay,guepex,easyandspeed,"Smara Sud, Section 14, Bloc N° 82+, Logement Participatif N° 06, El Eulma, Sétif","[""guepex"",""yalidine""]"
194901,Agence de Sétif Tinar,19,,Ouled Sabor,36.17157923395763,5.499381416584906,exact,carrier_relay,guepex,zimou-express,"Cité 600 logts Tinar,cité N°04,Bt N°19,local N°17","[""guepex""]"
195501,Agence Maabouda,19,,Sétif,36.18965846309601,5.391857886372733,exact,carrier_relay,guepex,yalidine,"Cite D'Al-Ma'Bouda, Escalier 1 Du Batiment B Section 203 Groupe 77 Parcelle 5","[""guepex"",""yalidine""]"
195502,Agence El Hidhab,19,,Sétif,36.21033727296476,5.445401329161286,exact,carrier_relay,guepex,guepex,"Cité El Hidhab, 110 Logements Participatifs, Bâtiment B, Classe 71","[""guepex"",""yalidine""]"
195504,Agence Centre Ville,19,,Sétif,36.188733083758066,5.414652623367429,exact,carrier_relay,yalidine,guepex,"Cité des Frères Mezouache, Section 240, Ilot 67, Rez-de-chaussée, Commune de Sétif","[""yalidine""]"
195505,Agence Sétif (1014 Logement),19,,Sétif,36.19528768347021,5.434247999999999,exact,carrier_relay,yalidine,yalidine,"373 شارع مركاش عبد الحميد اولاد ابراهم (التعاونية العقارية مالك ابن نبي) قسم 180 مجموع الملكية رقم 21, سطيف","[""yalidine""]"
195506,Agence de Tinar (Sétif),19,,Sétif,36.17110866093928,5.499059271164125,exact,carrier_relay,yalidine,yalidine,حي 600 مسكن تينار سيت 04 عم 19 يحمل 17 سطيف,"[""yalidine""]"
201101,Agence de Saïda,20,,Saïda,34.84330195332345,0.15648539493396532,exact,carrier_relay,guepex,yalidine,cité Riadh (à coté de la mosquée Riadh),"[""guepex"",""yalidine""]"
20701,Agence BOUKADIR,02,,Boukadir,36.06282900000001,1.120954542328247,exact,carrier_relay,yalidine,guepex,"Quartier ouest , rue des frères Ben Daoudia , section 82 grp de Propriéte n°105- BOUKADIR","[""yalidine""]"
210501,Agence de Azzaba,21,,Azzaba,36.73820784300283,7.103309891478236,exact,carrier_relay,guepex,guepex,"Enseigne Cite Za'Af Rabeh, Azzaba, Skikda","[""guepex"",""yalidine""]"
21101,Agence de Chlef,02,,Chlef,36.170713,1.334965,exact,carrier_relay,guepex,yalidine,route national N4 Chlef,"[""guepex"",""yalidine""]"
21102,Agence de Chlef,02,,Chlef,36.16073470034724,1.3307245621473522,exact,carrier_relay,guepex,guepex,"Cité Cherifi Kadour, 113","[""guepex"",""yalidine""]"
21103,Agence Hay El Nasr,02,,Chlef,36.15265428128475,1.3612961909921888,exact,carrier_relay,yalidine,zimou-express,"Agence Zimou Express, Hay El Nasr, Ouled Mohmed-Zone 04 (A coté de l'arrêt de bus)","[""yalidine""]"
211401,Agence de Collo,21,,Collo,37.00947083691242,6.56541830758666,exact,carrier_relay,guepex,guepex,"Boulevard Ruwaibah Taher, Collo, Skikda","[""guepex"",""yalidine""]"
211801,Agence de El Harrouch,21,,El Harrouch,36.652696909280046,6.842743529091004,exact,carrier_relay,guepex,guepex,"Cite 24 Logements Sociaux Covalent Sonatiba, El Harrouch, Skikda","[""guepex"",""yalidine""]"
212201,Agence Filfila,21,,Filfila,36.900991594853664,7.050328233410561,exact,carrier_relay,yalidine,yalidine,Cité KHAZOUZ Tahar 32 N16 Rez de chaussé,"[""yalidine""]"
213501,Centre de tri et Agence Messiouen (Skikda),21,,Skikda,36.85877780359665,6.8959575386774015,exact,carrier_relay,yalidine,yalidine,"30 logement Bt 02 Rue de Chaussée, Skikda","[""yalidine""]"
213502,Nouvelle Agence Skikda L'espérance,21,,Skikda,36.873354511972565,6.904929615263629,exact,carrier_relay,guepex,yalidine,"Rue El Reboua El Djamila, Partie N°01 Rez-de-chaussée, Skikda","[""guepex"",""yalidine""]"
213503,Agence de Faubourg (Skikda),21,,Skikda,36.86915957909143,6.907464813490152,exact,carrier_relay,guepex,guepex,"Rue Bachir BOUKADOUM BT: 06 local N°1, Faubroug, Skikda","[""guepex"",""yalidine""]"
213601,Agence Tamalous,21,,Tamalous,36.8376805589239,6.644938996450436,exact,carrier_relay,yalidine,yalidine,"Raf Souk Villa 03 N°04, Tamalous, Skikda","[""yalidine""]"
223601,Agence Sidi Bel Abbès,22,,Sidi Bel Abbes,35.18434154452605,-0.6141983368596451,exact,carrier_relay,guepex,yalidine,"Rue Mascara, (à Coté de l'hôtel Beni Talla), Sidi Bel Abbès","[""guepex"",""yalidine""]"
223602,Agence Benhamouda (Sidi Bel Abbès),22,,Sidi Bel Abbes,35.22229568347109,-0.6257365146791259,exact,carrier_relay,guepex,guepex,"Benhamouda, (Monté Sogral avant la mosquée El Safaa), Sidi Bel Abbès","[""guepex"",""yalidine""]"
230101,Agence de Valmascort,23,,Annaba,36.917000917596404,7.7527438280073016,exact,carrier_relay,guepex,yalidine,Avenue Seddik Benyahia Résidence * Fadi el Djamal *,"[""guepex"",""yalidine""]"
230102,Agence de Sidi Brahim,23,,Annaba,36.89262144958703,7.752825084569422,exact,carrier_relay,guepex,guepex,Champs de mars numéro n°3,"[""guepex"",""yalidine""]"
230103,Agence Sidi Achour,23,,Annaba,36.885157221183945,7.71491466148644,exact,carrier_relay,guepex,yalidine,"إقامة المنظر الجميل, Rte de Sidi Achour, Annaba","[""guepex"",""yalidine""]"
230501,Agence de El Bouni,23,,El Bouni,36.8559068,7.750210399999999,exact,carrier_relay,guepex,guepex,"El Bouni – Centre, Section n°47, Groupe de propriété n°135, Immeuble n°01","[""guepex"",""yalidine""]"
23401,Agence de Ténès,02,,Ténès,36.50473150265476,1.286761899576662,exact,carrier_relay,guepex,guepex,"Bt A2 Rdc Local 28, Sortie Ouest Route De Mostaganem","[""guepex"",""yalidine""]"
241901,Nouvelle Agence Guelma,24,,Guelma,36.45597784442608,7.426379566015017,exact,carrier_relay,guepex,yalidine,"Route Ain Larbi, local N°01, Guelma","[""guepex"",""yalidine""]"
243001,Agence de Oued Zenati,24,,Oued Zenati,36.30792321013235,7.160464035448827,exact,carrier_relay,guepex,guepex,Magasin Num 02,"[""guepex"",""yalidine""]"
250401,Agence Belle Vue,25,,Constantine,36.3529999173718,6.608103735250445,exact,carrier_relay,guepex,yalidine,"70 Rue Belle Vue, Les Combattants (Ancienne Ville)","[""guepex"",""yalidine""]"
250402,Agence Sidi Mabrouk,25,,Constantine,36.36117011786894,6.636566271164361,exact,carrier_relay,guepex,guepex,نهج لعراقب احمد رقم 09,"[""guepex"",""yalidine""]"
250403,Agence de Constantine (Zouaghi),25,,Constantine,36.31233464226101,6.625446226981942,exact,carrier_relay,guepex,zimou-express,"Illot N°01 , 212, ain el bay, zouaghi, Constantine","[""guepex"",""yalidine""]"
250501,Agence de Didouche Mourad,25,,Didouche Mourad,36.44833167015881,6.630756215108476,exact,carrier_relay,guepex,yalidine,El Riadh n°10,"[""guepex"",""yalidine""]"
250601,Agence d'El Khroub,25,,El Khroub,36.264496940142756,6.689403542328722,exact,carrier_relay,guepex,guepex,Cité Bouhali Mohamed Said El Khroub,"[""guepex"",""yalidine""]"
250602,Agence Nouvelle Ville Ali Mendjeli,25,,El Khroub,36.25992159231852,6.593449177806023,exact,carrier_relay,guepex,yalidine,"Zone d'Activité N°47 Nouvelle Ville, Ali Mendjeli , El Khroub, Constantine","[""guepex"",""yalidine""]"
250605,Agence nouvelle ville Ali mendjli Square,25,,El Khroub,36.22914576332777,6.5751325423287215,exact,carrier_relay,guepex,guepex,650 lpa عمارة 24 زاوية محل 145,"[""guepex"",""yalidine""]"
260701,Agence Médéa (Beni Slimane),26,,Beni Slimane,36.228267439084156,3.310825256843856,exact,carrier_relay,guepex,yalidine,مجموعة ملكية رقم 44 قسم 44 بالتجزئة 55 حصة بني سليمان,"[""guepex"",""yalidine""]"
260801,Agence Berrouaghia,26,,Berrouaghia,36.1324003304314,2.911086,exact,carrier_relay,yalidine,guepex,"Lotissement Ali Ben Haoua Cité Mohammedi , Berrouaghia, Médéa","[""yalidine""]"
263301,Agence de Médéa (M’sallah),26,,Médéa,36.25896865121911,2.7612782711641226,exact,carrier_relay,guepex,yalidine,"Rue M’sallah, Médéa","[""guepex"",""yalidine""]"
263302,Agence de Médéa (Pole Urbain),26,,Médéa,36.267663838556054,2.7906953509033734,exact,carrier_relay,guepex,guepex,Cité 80 Logs LSP Pole Urbain (à coté de la station de service Benhafri),"[""guepex"",""yalidine""]"
265901,Agence Tablat,26,,Tablat,36.40665669612093,3.3224722,exact,carrier_relay,guepex,yalidine,"Rue Nationale N:08, Tablat, Médéa.","[""guepex"",""yalidine""]"
271801,Agence de Salamandre,27,,Mostaganem,35.9213552114013,0.07318708477898198,exact,carrier_relay,guepex,yalidine,"Salamandre (Rond Point De La Douane), Mostaganem","[""guepex"",""yalidine""]"
271802,Agence de Kharouba (Mostaganem),27,,Mostaganem,35.975042654997694,0.10676934149873608,exact,carrier_relay,guepex,guepex,"Cité 600 Logement Kharouba, Mostaganem","[""guepex"",""yalidine""]"
281001,Agence de Berhoum,28,,Berhoum,35.65709385298696,5.030348826732219,exact,carrier_relay,guepex,guepex,محل رقم 03 مجموعة ملكية 333 قسم 02 حي زيغود يوسف بلدية برهوم,"[""guepex"",""yalidine""]"
281201,Agence de Bou Saâda,68,,Bou Saâda,35.22031324045397,4.178352103974209,exact,carrier_relay,guepex,yalidine,Cite 20 Aout 636/N°05 A,"[""guepex"",""yalidine""]"
282802,Agence Salem Shopping Mall,28,,M'Sila,35.711826195939764,4.533467813415232,exact,carrier_relay,guepex,yalidine,"Salem Shopping Mall, centre commercial (en face la daïra)","[""guepex"",""yalidine""]"
283901,Agence Sidi Aïssa,28,,Sidi Aïssa,35.872334331109606,3.7830036541912944,exact,carrier_relay,guepex,guepex,بلدية سيدي عيسى E03 محل 07 حي الوئام المدني مجموعة ملكية 05 قسم 46 عمارة,"[""guepex"",""yalidine""]"
292801,Agence de Mascara,29,,Mascara,35.401212227438585,0.1493982676612564,exact,carrier_relay,guepex,yalidine,zone 08 a coté de la poste Emir Abdelkader,"[""guepex"",""yalidine""]"
300801,Agence de Hassi Messaoud,30,,Hassi Messaoud,31.688989360431812,6.068568678310962,exact,carrier_relay,guepex,yalidine,"Derrière la CNAS, à coté de la clinique Ibn Sina","[""guepex"",""yalidine""]"
30102,Agence Laghouat (Cité OASIS),03,,Laghouat,33.811561602108206,2.8597337097525823,exact,carrier_relay,guepex,easyandspeed,"Cité l'OASIS, centre ville Laghouat, Laghouat.","[""guepex"",""yalidine""]"
301301,Agence de Ouargla Centre Ville,30,,Ouargla,31.96296665406084,5.324182871163383,exact,carrier_relay,guepex,guepex,حي حركات,"[""guepex"",""yalidine""]"
301302,Agence de Ouargla (Chetti el Wekal),30,,Ouargla,31.942699293799976,5.312770721210608,exact,carrier_relay,guepex,yalidine,"Ave 1er novembre 1954, El Mkhadma, (Arrêt de tram Chatte El Wakla)","[""guepex"",""yalidine""]"
310101,Saint Hubert,31,,Oran,35.67576049674193,-0.6399573752101966,exact,carrier_relay,guepex,yalidine,Rue de l'ANP Projet rue 153 GV 50-89 part 2 et 3 (Entre CPA ET CASNOS),"[""guepex""]"
310102,Agence Cité Djamel,31,,Oran,35.69672884038709,-0.6024611501953713,exact,carrier_relay,guepex,guepex,"Rond-point Cité Djamel (En Allant vers Hai Sabah), Cité Djamel, Oran","[""guepex"",""yalidine""]"
310103,Agence de Gambetta,31,,Oran,35.70584160555386,-0.6116408828756563,exact,carrier_relay,guepex,zimou-express,"54 avenue d'arcole, Bouguerri Khelifa, Gambetta","[""guepex"",""yalidine""]"
310104,Agence de Canastel,31,,Oran,35.7453859649244,-0.5692101104496627,exact,carrier_relay,yalidine,speedmail,"25, Rue Akid Lotfi Local N° 02, Canastel, Oran","[""yalidine""]"
310105,Agence MARAVAL,31,,Oran,35.671703284198706,-0.6511472711641236,exact,carrier_relay,yalidine,guepex,"Cité El Othmania, rue Boubkeur Belkaid N° 01, local N° 01, rez-de-chaussée, commune d'Oran-ORAN","[""yalidine""]"
310301,Agence El Morchid,31,,Bir El Djir,35.710492588656976,-0.5869307488573879,exact,carrier_relay,guepex,yalidine,"Coopérative Immobilière Dar El Amel N°68, El Morchid, Oran","[""guepex"",""yalidine""]"
310302,Agence Fernand Ville,31,,Bir El Djir,35.730398307760176,-0.5790437244693557,exact,carrier_relay,guepex,yalidine,"65 Rue 1er Novembre Hai Khemisti ,Part 4 (Mosquée el Kods), Fernand Ville, Oran","[""guepex"",""yalidine""]"
310303,Agence ILAF Belkaïd (Oran),31,,Bir El Djir,35.74383317481581,-0.5439541698194157,exact,carrier_relay,guepex,easyandspeed,"Groupe 122 Logement - Résidence ILAF Belkaïd, Oran","[""guepex"",""yalidine""]"
310601,Agence de Arzew,31,,Arzew,35.84733672313886,-0.31784657704458,exact,carrier_relay,guepex,guepex,17 Lotissement N 66 Plan Lot 167,"[""guepex"",""yalidine""]"
31901,Agence de Aflou,59,,Aflou,34.11114198779646,2.0961174596054004,exact,carrier_relay,guepex,yalidine,"Hai Zahi Ben Aissa, Route El Bayadh (à coté de la centrale de police)","[""guepex"",""yalidine""]"
320101,Agence de El Bayadh,32,,El Bayadh,33.68182465412115,1.0147081430506253,exact,carrier_relay,guepex,yalidine,Rue Mohamed Touil (A Cote Auberge Hanna),"[""guepex"",""yalidine""]"
330101,Agence de Illizi,33,,Illizi,26.506170413905355,8.489622372352972,exact,carrier_relay,guepex,guepex,Chemin Ain El Kours Cite Salam,"[""guepex"",""yalidine""]"
330601,Agence In Amenas,33,,In Amenas,28.050180003262113,9.578835500000002,exact,carrier_relay,guepex,guepex,القسم 12 مجموعة ملكية 56-342 مسكن بلدية ان اميناس,"[""guepex"",""yalidine""]"
